id,audio_path,text,caption_1,caption_2,caption_3,caption_4,caption_5,split,file_name,sample_rate,duration_s,loudness,sharpness,roughness,fluctuation_strength_proxy,pr_ecma_st,fluctuation_evr,fluctuation_ami,fluctuation_rms_mod,error,compute_time_s
development/Splitting _ chopping logs in a shed.wav,/root/clawd/_datasets/clotho_3490684/audio_development/development/Splitting _ chopping logs in a shed.wav,A ball is being thrown at wooden blocks.,A ball is being thrown at wooden blocks.,A person drops an object on a hard surface several times.,A person picks up and drops an object onto a hard surface.,An axe is splitting a log of wood multiple times,An axe splitting a log of wood multiple times,development,Splitting _ chopping logs in a shed.wav,44100,27.981315192743764,13.383,1.7057607542701574,2.6422742153477987,,0.0,4836922.589258248,148415.50855781024,0.023094244213800744,"",18.689
development/scrape.wav,/root/clawd/_datasets/clotho_3490684/audio_development/development/scrape.wav,A hard object is being scraped against another hard object erratically.,A hard object is being scraped against another hard object erratically.,A jar is opened and the lid is coming off followed by a zipper.,An antique radio picks up signals with difficulty.,Radio stations are roughly being tuned in on a old radio.,Someone taps their hand repeatedly and then uses a zipper.,development,scrape.wav,44100,15.78766439909297,22.15,1.2161887731543437,4.741058197544166,,0.0,410964.2979908572,5152.650832899855,0.11321795097370123,"",19.714
"development/Neighbours saturday moning street activity, GREENFIELD PLACE (Snippet).wav","/root/clawd/_datasets/clotho_3490684/audio_development/development/Neighbours saturday moning street activity, GREENFIELD PLACE (Snippet).wav",A child talking to an adult with a hard object hitting another hard surface and a car starting.,A child talking to an adult with a hard object hitting another hard surface and a car starting.,An girl speaks before a car door is slammed and the engine starts.,An girl speaks before an car door is slammed perfectly and the engine starts.,"Children speak with an adult while something thumps, and then a car starts.","While something thumps, children are speaking with an adult, and then a car starts.",development,"Neighbours saturday moning street activity, GREENFIELD PLACE (Snippet).wav",44100,23.576916099773243,11.482,1.3874627949058347,0.5689789322388018,,0.0,2970.1956409643926,871.2036080623025,0.038838041661912445,"",29.888
development/kleiner_servo.wav,/root/clawd/_datasets/clotho_3490684/audio_development/development/kleiner_servo.wav,A drill is being turned between high and low in the background.,A drill is being turned between high and low in the background.,A drill is being turned high and low in the background.,A machine emits a high pitched screech every few seconds.,A machine is running and performing a drilling function and other machinery is running in the background.,A machine running and performing a drilling function and other machinery is running in the background.,development,kleiner_servo.wav,44100,21.05,29.76,1.5241233723794614,0.19227995526173158,,10.945764901011394,3102.2417385642825,378.57284420711426,0.05845116164227376,"",39.046
development/Outdoor Festival 1.wav,/root/clawd/_datasets/clotho_3490684/audio_development/development/Outdoor Festival 1.wav,Adults and children are speaking in a crowd.,Adults and children are speaking in a crowd.,Parents and children are at a large school function.,People are chatting in a fairly large group with children.,People chatting in a fairly large group with children.,People talk as kids are play around them outside.,development,Outdoor Festival 1.wav,44100,24.007732426303853,28.28,1.3979381611505812,0.4867943048388357,,0.0,2084.4463517029667,493.2976142222272,0.03269128981956369,"",48.406
development/Whitelee Windfarm cafe.wav,/root/clawd/_datasets/clotho_3490684/audio_development/development/Whitelee Windfarm cafe.wav,A group of people talking inside of a large room.,A group of people talking inside of a large room.,"In a busy room, several people are talking and moving.",People in a kitchen chat while pots clang about.,Several people talking and moving in a busy room.,Some men and women stand talking in a bar while they prepare to play pool.,development,Whitelee Windfarm cafe.wav,44100,19.61360544217687,25.08,1.3199170917487315,0.6144837394784154,,0.0,6335.1831722090465,949.9709098535943,0.04011101866025532,"",34.786
development/WasherEndofSpinCycleStartRestCycle.wav,/root/clawd/_datasets/clotho_3490684/audio_development/development/WasherEndofSpinCycleStartRestCycle.wav,"A loud machine is running until something is flipped, where the noise becomes slightly quieter until the end.","A loud machine is running until something is flipped, where the noise becomes slightly quieter until the end.",An engine is whirring and then slows down a bit,Loud machine running until something is flipped where the noise becomes slightly less loud until the end.,The engine buzzed to a roar and then slowed to idle,The hum of the fan was interrupted by the crack of the stick and ball sinking in the pocket.,development,WasherEndofSpinCycleStartRestCycle.wav,44100,29.869637188208618,27.59,1.2172002979273226,1.0873984425598102,,0.0,13372.153766376956,946.9319387627618,0.03977232689950483,"",53.279
development/md1trk10.wav,/root/clawd/_datasets/clotho_3490684/audio_development/development/md1trk10.wav,Hard objects are scraping and grinding against other hard surfaces.,Hard objects are scraping and grinding against other hard surfaces.,Hard objects are scraping and moving across another hard surface.,"In a mostly empty room, a metal object screeches along a concrete floor.",Metal scraping along metal but the sound is distorted and prolonged.,The prolonged distortion of metal on metal created a loud sound.,development,md1trk10.wav,44100,19.912244897959184,30.84,1.6878207746883889,3.371281568565553,,14.894007029813634,195747.19289054253,3483.342351976967,0.05916503189328158,"",35.345
development/mowerbird.wav,/root/clawd/_datasets/clotho_3490684/audio_development/development/mowerbird.wav,Birds chirping excitedly in the foreground with a lawnmower running in the distance.,Birds chirping excitedly in the foreground with a lawnmower running in the distance.,Birds tweet in the background as someone is mowing the lawn.,Birds tweet in the background while someone is mowing the lawn.,Other birds answer to a bird that is chirping.,The lawnmower runs in the distance and the excited birds are chirping in the background.,development,mowerbird.wav,44100,29.15265306122449,23.13,2.298805392810894,0.42113496111072674,,0.0,107776.54201042649,3932.942984973927,0.03897917691032594,"",53.673
development/wind-noise.wav,/root/clawd/_datasets/clotho_3490684/audio_development/development/wind-noise.wav,A strong wind is blowing hard through a confined space.,A strong wind is blowing hard through a confined space.,Someone is driving down the road with the recorder on.,Someone is driving down the road with their recorder on.,Wind is blowing hard through a confined space.,a broken radio that is not able to find a station,development,wind-noise.wav,44100,21.06800453514739,28.15,1.2351689320898918,0.9446048932596505,,0.0,385.2072263391221,171.89921131634657,0.023661173211965852,"",22.139
development/md3trk2.wav,/root/clawd/_datasets/clotho_3490684/audio_development/development/md3trk2.wav,A person is using an old copy machine.,A person is using an old copy machine.,A person that is using an old office machine.,A rotary phone is used by slowly turning the dial.,An electric machine is functioning with a time break,The electric machine is functioning with a time break,development,md3trk2.wav,44100,17.69156462585034,13.727,1.2645379693208436,2.529746343016098,,0.0,54840.587069442794,3721.948552273722,0.028166252654319917,"",18.664
development/loud_car.wav,/root/clawd/_datasets/clotho_3490684/audio_development/development/loud_car.wav,A motorcycle zooms down the highway while passing by nearby traffic.,A motorcycle zooms down the highway while passing by nearby traffic.,A variety of vehicles cruising down the highway.,A vehicle is heard passing by and then it quiets before another vehicle passes by.,A vehicle passed by and then it was quiet until another vehicle passed by.,Several cars are driving moderately fast on a roadway in traffic,development,loud_car.wav,44100,24.706031746031748,19.2,1.345478637616527,0.1360792174735463,,0.0,2719.807814490574,548.0459767300462,0.023050324498749504,"",33.495
development/Rain with thunder.wav,/root/clawd/_datasets/clotho_3490684/audio_development/development/Rain with thunder.wav,A rainstorm with moderate rain falling and thunder in the background.,A rainstorm with moderate rain falling and thunder in the background.,Pouring rain and in the distance echoing passing thunder.,Rain is pouring from the sky together with passing thunder echoing in the distance.,Thunder is in the background of a moderately falling rain.,"rain coming down to earth, making contact with the ground.",development,Rain with thunder.wav,44100,29.33063492063492,19.99,2.1194465094962687,1.2535434134541297,,0.0,23849.63573446913,2615.4487626868763,0.015161115359132254,"",69.208
development/Low Pitch Wine Glass with Overtones.wav,/root/clawd/_datasets/clotho_3490684/audio_development/development/Low Pitch Wine Glass with Overtones.wav,A horn type instrument is being blown at different volumes and pitches.,A horn type instrument is being blown at different volumes and pitches.,A violin is being played very slowly creating slow violin noises.,A violin is played very slowly creating music.,An electrical piece of equipment is being used to generate interference noises that are unpleasant.,An instrument in the horn family is being blown at different volumes and pitches.,development,Low Pitch Wine Glass with Overtones.wav,44100,17.04344671201814,18.68,0.6615805729826444,0.1922570430295874,,47.44390865298985,24182.534632253388,1028.3783397173306,0.1174479944634329,"",11.664
development/Spray.wav,/root/clawd/_datasets/clotho_3490684/audio_development/development/Spray.wav,A person is spraying on a wall outside,A person is spraying on a wall outside,A person sprays a can of liquid air on the keyboard and they set the can down on table.,A spray bottle is sprayed on a surface to clean it.,A person sprays the surface before cleaning it.,The wall outside is being covered in spray paint.,development,Spray.wav,44100,29.60544217687075,11.415,2.670667339539505,4.253876224393656,,0.0,243727.2008173512,6616.28326518358,0.019728085788124357,"",38.376
development/porto_morning_tropical_birds_market_19.wav,/root/clawd/_datasets/clotho_3490684/audio_development/development/porto_morning_tropical_birds_market_19.wav,A lot of birds are chirping and singing while in close proximity to each other with people talking nearby.,A lot of birds are chirping and singing while in close proximity to each other with people talking nearby.,Birds chirp in the trees at the park while children are playing.,Children playing at a park with birds chirping in the trees.,Multiple birds chirp simultaneously in the background while people faintly converse.,Multiple birds chirped simultaneously in the background while people conversed.,development,porto_morning_tropical_birds_market_19.wav,44100,29.598526077097507,28.35,2.340519036752458,0.16104994220308924,,0.0,26628.230767773854,1337.4202915111282,0.04731995205025126,"",66.948
development/static_weather_report.wav,/root/clawd/_datasets/clotho_3490684/audio_development/development/static_weather_report.wav,A radio is playing a scratchy sounding broadcast.,A radio is playing a scratchy sounding broadcast.,A person is speaking on a radio channel that has a lot of static interference.,"The radio broadcasts a person speaking, and it sounds scratchy.",A person is speaking in a radio broadcast.,A person is speaking on a radio channel that has lots of static interference.,development,static_weather_report.wav,44100,26.533990929705215,33.72,1.6344571467709175,1.0844640548540883,,0.0,5614.9883183046195,637.347330475531,0.03483137651583093,"",47.739
development/U-Bahnhof Berlin Alanderplatz U-Bahn Abfahrt.wav,/root/clawd/_datasets/clotho_3490684/audio_development/development/U-Bahnhof Berlin Alanderplatz U-Bahn Abfahrt.wav,A commuter train leaves the platform for its destination.,A commuter train leaves the platform for its destination.,"An announcement plays, then a vessel speeds up with a high pitch.","An announcement system broadcasts, then a vessel accelerates with a high pitch.","Humming of distant engines with a voice speaking on an intercom, one engine revs up and speeds into the distance","Through the humming of engines and a voice on an intercom, one engine revs up and speeds into the distance.",development,U-Bahnhof Berlin Alanderplatz U-Bahn Abfahrt.wav,44100,26.062607709750566,28.82,1.295623955627751,0.20274731085194622,,0.0,95606.34349885656,3156.7318396223604,0.02104922835322979,"",47.704
development/maryam sounds 5.wav,/root/clawd/_datasets/clotho_3490684/audio_development/development/maryam sounds 5.wav,A high pitched and continuous scraping of objects against a surface,A high pitched and continuous scraping of objects against a surface,A person holding and moving around coins in their hand.,A person who has a ton of coins in their hand moving them around.,A sharp jingling occurs as a metallic object is rattled.,The jingling of a metal object being rattled.,development,maryam sounds 5.wav,44100,15.797868480725624,9.319,3.6736777164031493,4.67878169727186,,0.0,4609.970241262378,586.6775606107835,0.017586782022313365,"",29.129
development/rainbirdsdropletmar19.wav,/root/clawd/_datasets/clotho_3490684/audio_development/development/rainbirdsdropletmar19.wav,From the roof top rain was falling and water was dripping into a metal container.,From the roof top rain was falling and water was dripping into a metal container.,It is raining and also things are blowing in the wind.,It started raining first then things started blowing in the wind.,Rain was falling and water was dripping from the roof ton a metal container.,a rain storm with a clock ticking in the background,development,rainbirdsdropletmar19.wav,44100,18.420975056689343,6.282,1.8209361739513659,0.35706386363326537,,0.0,13531696.054078259,50322.71423680928,0.07774363799648627,"",29.804
"development/Neighborhood ambiance birds chirping, wind.wav","/root/clawd/_datasets/clotho_3490684/audio_development/development/Neighborhood ambiance birds chirping, wind.wav",A man is driving slowly by the park while birds are chirping.,A man is driving slowly by the park while birds are chirping.,Birds are chirping in the park while a man drives past slowly.,Birds are squawking in tandem with one another in the forest.,Birds chirp while the wind blows close by.,Birds sing while the wind blows close by and in over them.,development,"Neighborhood ambiance birds chirping, wind.wav",44100,24.499274376417233,8.072,1.424034492859198,5.236006245134841,,18.55301203387809,14233.807331955042,2138.0938802573023,0.039672816378435644,"",31.671
development/Maziarnia Lake - waves and wind - Zoom H2n.wav,/root/clawd/_datasets/clotho_3490684/audio_development/development/Maziarnia Lake - waves and wind - Zoom H2n.wav,A person is paddling a boat through the water.,A person is paddling a boat through the water.,A person is swimming in water and wind is in the background.,Someone splashes about in water despite the cold wind that is blowing.,Something continuously is splashing in the water making a light bubbling sound,Water swishes around back and forth over and over again.,development,Maziarnia Lake - waves and wind - Zoom H2n.wav,44100,27.511473922902493,18.92,1.576436972863735,2.0090821053229937,,0.0,13907.98760774435,1083.9271412760052,0.02862905535895332,"",49.635
development/Mess_room_sounds.wav,/root/clawd/_datasets/clotho_3490684/audio_development/development/Mess_room_sounds.wav,A group of people are speaking together inside of a kitchen.,A group of people are speaking together inside of a kitchen.,A group of people are talking during a meal while someone coughs in the background.,People talk to each other before plates and silverware clang in the background and a person coughs.,"Several voices are talking in the distance, and kitchenware is being moved around.",Several voices talking in the distance and kitchenware being moved around,development,Mess_room_sounds.wav,44100,23.795396825396825,17.78,1.437154914454648,0.44153434762432825,,0.0,1026.1241576859807,514.6636061165249,0.03407386620033513,"",37.26
development/rain_driveway_tunnel_drip_03.wav,/root/clawd/_datasets/clotho_3490684/audio_development/development/rain_driveway_tunnel_drip_03.wav,"A male voice is talking , rain in the background","A male voice is talking , rain in the background",A male voice talking with rain in the background,A man making a recorded or voice message and then dripping water,A water tunnel with water running and the voice of a man,A water tunnel with water running through it and a man speaks.,development,rain_driveway_tunnel_drip_03.wav,44100,24.473832199546486,15.832,1.1846099796347251,2.8280135802466706,,0.0,175759.7172684391,6055.389007073174,0.031822662241793316,"",33.9
development/Snapping twig.wav,/root/clawd/_datasets/clotho_3490684/audio_development/development/Snapping twig.wav,A person is rummaging through small objects and picks and drop some.,A person is rummaging through small objects and picks and drop some.,A person rummaging through small objects picks and drops some.,A very faint tapping followed with faint crinkling.,A very faint tapping is followed by a faint crinkle.,Multiple hard objects are being rubbed together and dropped on one another.,development,Snapping twig.wav,44100,17.03183673469388,4.334,3.1700710846860383,2.9890546728157146,,0.0,2245.8327938032717,994.2284414764353,0.0031949763612426733,"",8.68
development/Opening and closing curtain.wav,/root/clawd/_datasets/clotho_3490684/audio_development/development/Opening and closing curtain.wav,A long chain was dropped on the ground bit by bit,A long chain was dropped on the ground bit by bit,Metal tools clang together over and over in the background.,"Sharp, quick, metallic pulls at several second intervals.",The sharp metallic pings were in quick succession.,Metal tools clang together in the background over and over,development,Opening and closing curtain.wav,44100,22.07578231292517,13.624,2.2642939936599684,2.492527673770487,,0.0,19055.177978123953,1449.3834428407347,0.016583158708819976,"",25.315
development/Texture03.wav,/root/clawd/_datasets/clotho_3490684/audio_development/development/Texture03.wav,A worker works on the factory floor with a machine.,A worker works on the factory floor with a machine.,A metal door is opening as the it echoes down a hallway.,A person checks some pipes and then a door is opened.,a factory working on a factory floor working on a machine,metal door is opening in a narrow hallway where sounds reverberate,development,Texture03.wav,44100,19.724489795918366,14.018,1.7159819476433305,0.5082397993946045,,0.0,3536.7432864091534,1109.4886328463247,0.015535605833717749,"",30.355
development/Study light riffles.wav,/root/clawd/_datasets/clotho_3490684/audio_development/development/Study light riffles.wav,"From beginning to end, a spring makes a noise.","From beginning to end, a spring makes a noise.",Running a pencil down a wavy plastic pipe.,"Someone runs a pencil down a plastic pipe, which is wavy.",Someone winds up a mechanical toy that moves.,a toy with a mechanical movement is being winded up,development,Study light riffles.wav,44100,22.759909297052154,14.155,2.3465487048114753,3.104820745122102,,0.0,978966.1545109329,13254.233021560247,0.01620972530780011,"",34.214
development/Neighbourhood evening ambience.wav,/root/clawd/_datasets/clotho_3490684/audio_development/development/Neighbourhood evening ambience.wav,"A bird screamed and cricket screeching, the bird screamed again.","A bird screamed and cricket screeching, the bird screamed again.","Birds, insects and animals in an outdoor environment",Crickets are chirping and it seems like a person is doing something in the background.,Crickets are chirping while a person is active in the background.,"birds, insects and animals in a mildly noisy environment",development,Neighbourhood evening ambience.wav,44100,20.696054421768707,21.42,2.09523926709268,0.10122581832312318,,11.331328076463969,943.2060569989786,335.290370538879,0.025260597428559014,"",43.447
development/Rain_06.wav,/root/clawd/_datasets/clotho_3490684/audio_development/development/Rain_06.wav,A large printing press is in operation as paper streams through the conveyor belts.,A large printing press is in operation as paper streams through the conveyor belts.,A very heavy rain is noisily falling fast.,"A very heavy, noisy rain is falling fast.",Rainfall is pouring down heavily on a roof.,Rain is falling down on a roof in a heavy down pour.,development,Rain_06.wav,44100,25.29705215419501,41.19,2.030919984738945,0.11457056417864098,,0.0,646.8940251322514,257.53670419279763,0.01841758333278963,"",57.76
development/wool factory hamburg.wav,/root/clawd/_datasets/clotho_3490684/audio_development/development/wool factory hamburg.wav,A large machine making noises outside with people speaking in the background.,A large machine making noises outside with people speaking in the background.,A noisy rattle of machinery masks the doorbell and later talking people.,A piece of machinery with belts is running and a constant clanging.,A piece of machinery with belts running and a constant clanging.,a crowd of people are in background as a machine is also making noise in the background,development,wool factory hamburg.wav,44100,27.57387755102041,29.04,1.982142072221072,0.18430219672724188,,0.0,9730.855168005488,2145.1143460755234,0.03555859840355479,"",67.178
development/Pylone-dans-le-vent-Grenoble.wav,/root/clawd/_datasets/clotho_3490684/audio_development/development/Pylone-dans-le-vent-Grenoble.wav,A boat is sailing through the water splashing water as it goes.,A boat is sailing through the water splashing water as it goes.,A boat splashes water as it motors down the river.,A car drives by a flooded part of the road and hits a large puddle of mud.,A car is driving and a machine is doing power washing with water.,A rain storm passes through a town as an alarm system sounds.,development,Pylone-dans-le-vent-Grenoble.wav,44100,28.69049886621315,30.28,1.4010078992777018,0.15268241097548868,,0.0,9658.544967526852,1576.8412795461534,0.03624895390831592,"",60.349
development/On_Bus.wav,/root/clawd/_datasets/clotho_3490684/audio_development/development/On_Bus.wav,"A car is squeaking, as it revs up and increases speed.","A car is squeaking, as it revs up and increases speed.","A mechanical rattling resonance occurs upon lowering acceleration of a vehicle, followed by sneezing of a woman.",A shopping cart is being pushed while cars drive in the background.,"A vehicle accelerates then diminishes, a mechanical rattling resonating then a woman sneezes.",The metal will squeak as a vehicle motor goes faster and slower.,development,On_Bus.wav,44100,19.810839002267574,28.13,1.3697416034113823,0.26743981375192694,,0.0,4040.2538653223023,701.545762489309,0.038880222431681974,"",37.087
development/Smag&#39;s Glass.wav,/root/clawd/_datasets/clotho_3490684/audio_development/development/Smag&#39;s Glass.wav,A man is ascending a staircase and sneezes two times.,A man is ascending a staircase and sneezes two times.,A man is walking up a flight of stairs and sneezes twice.,"A person shuffles around, sneezes, and coughs loudly.","The walking, rustling, and breathing sounds were followed by the man sneezing twice","Walking, rustling and breathing sounds followed by a man sneezing twice.",development,Smag&#39;s Glass.wav,44100,15.053492063492063,19.6,1.4375175809660183,3.2680867383172347,,0.0,574416.8486632848,10960.431823775898,0.05064047460308864,"",18.199
development/officeWaterPump.wav,/root/clawd/_datasets/clotho_3490684/audio_development/development/officeWaterPump.wav,"A drink in a bottle is opened, poured and emptied into a container.","A drink in a bottle is opened, poured and emptied into a container.","A torrent of water gushes forth, then the stream slows and gurgles down the drain.","Water flows on a sink and stops, and dries to a trickle",Water pouring into a tub very quickly and then slowing down and draining.,"Water streaming on the sink, stopping for a moment, only some drops",development,officeWaterPump.wav,44100,25.321360544217686,17.9,1.9857155540942422,3.9346659527386136,,0.0,37509.526085303325,2545.291495670959,0.01342265769979362,"",36.892
"development/Ollantaytambo canales de agua, Cuzco, Peru.wav","/root/clawd/_datasets/clotho_3490684/audio_development/development/Ollantaytambo canales de agua, Cuzco, Peru.wav",A very rain is falling and hitting the ground,A very rain is falling and hitting the ground,It is raining down intensely and falling in a body of water.,It is raining hard and falling into a body of water.,The rain drops fall heavily and extremely fast.,The rain flows heavily and splatters out onto the ground,development,"Ollantaytambo canales de agua, Cuzco, Peru.wav",44100,16.261655328798184,38.95,2.00745241220179,0.26183579581433647,,0.0,1220.6022816985344,407.5377478085063,0.02362426970383161,"",39.79
