id,audio_path,text,caption_1,caption_2,caption_3,caption_4,caption_5,split,file_name,sample_rate,duration_s,loudness,sharpness,roughness,fluctuation_strength_proxy,pr_ecma_st,fluctuation_evr,fluctuation_ami,fluctuation_rms_mod,error,compute_time_s
development/BACKYARD_BLACKBIRD_DAWN.wav,/root/clawd/_datasets/clotho_3490684/audio_development/development/BACKYARD_BLACKBIRD_DAWN.wav,A bird calls out from inside a building.,A bird calls out from inside a building.,"A bird chirps loudly, then stops, then resumes chirping again.",A bird chirps while waves crash nearby in the ocean.,A bird is calling out inside a building.,A bird whistling as the ocean waves crash by.,development,BACKYARD_BLACKBIRD_DAWN.wav,44100,18.493832199546485,22.62,1.7961594240305847,2.194434822308897,,0.0,59065.29850668665,1958.2543281668884,0.05716930234937305,"",27.678
development/Waves on a quiet New Zealand beach.wav,/root/clawd/_datasets/clotho_3490684/audio_development/development/Waves on a quiet New Zealand beach.wav,The rocks on the beach are being pounded with waves.,The rocks on the beach are being pounded with waves.,Waves crash against the rocks on a beach.,Waves crash down forcefully which are very intense.,Waves crashing up against a rocky shore on the beach.,waves are coming with high force and intensity,development,Waves on a quiet New Zealand beach.wav,44100,20.425374149659863,32.77,1.628869277415978,0.11766088451486659,,0.0,14674.798451056868,1043.6137041594661,0.03076699057980015,"",44.393
development/London Underground- Stratford station ambience.wav,/root/clawd/_datasets/clotho_3490684/audio_development/development/London Underground- Stratford station ambience.wav,A busy public place with a crowd of people and a phone ringing,A busy public place with a crowd of people and a phone ringing,A phone is ringing in a busy public place with a crowd of people.,A phone rings as some people are talking while walking.,People are speaking in a good sized group and a phone dial rings.,The phone rings while people speak in the background.,development,London Underground- Stratford station ambience.wav,44100,21.738798185941043,24.38,1.3629547540417513,1.9608826151010317,,16.57336041651734,6833.47994738055,694.5540649740129,0.07645913032891638,"",39.32
development/Brook20Sec.wav,/root/clawd/_datasets/clotho_3490684/audio_development/development/Brook20Sec.wav,A gentle stream flowing while making bubbling sounds.,A gentle stream flowing while making bubbling sounds.,The water flows down the drain spout at a consistent rate.,The water is flowing down the spout at a consistent rate.,Water continues to be poured in a container that already has water.,Water is flowing from a multitude of places.,development,Brook20Sec.wav,44100,19.997687074829933,21.29,1.9847192338996502,1.0303728440723328,,0.0,441.9295973446531,210.32901788334854,0.014711387550412677,"",39.959
development/atrium.wav,/root/clawd/_datasets/clotho_3490684/audio_development/development/atrium.wav,"A large room with a group of men, women, and children speaking to one another.","A large room with a group of men, women, and children speaking to one another.","In a large hall, a cacophony of voices are speaking.",Many people are gathered in the same area while several conversations are going on at the same time,"Many people gathered in the same area, several conversations going on at the same time",Men women and children are speaking to each other in a large room.,development,atrium.wav,44100,29.530702947845803,35.65,1.3591028075399658,0.6288902489825634,,0.0,1925.3360597153082,420.8960529117166,0.03322815747451038,"",57.923
development/Cable Car Ride Birds.wav,/root/clawd/_datasets/clotho_3490684/audio_development/development/Cable Car Ride Birds.wav,A fan is spinning and then a lock is turned and a door opens.,A fan is spinning and then a lock is turned and a door opens.,An electric buzzing hums as a machine moves.,An electric buzzing hums while a machine is moving,The motor of a fan spins and whines while a clatter of cacophony occurs,"The spinning of a fan then a door lock is turned, and opened.",development,Cable Car Ride Birds.wav,44100,20.542743764172336,11.558,1.1876059263428709,0.48065996846055214,,0.0,11235.409828596068,1379.9152168858266,0.04635516152543716,"",20.917
development/forest_ambience_copake_winter_1.wav,/root/clawd/_datasets/clotho_3490684/audio_development/development/forest_ambience_copake_winter_1.wav,"A bird is chirping outside, and an animal occasionally wails.","A bird is chirping outside, and an animal occasionally wails.",A variety of birds cackling and chirping while a large volume of air is moving nearby.,As the wind bellows nearby a cacophony of birds singing and calling sounds.,Crows are crowing while a steady wind is blowing in the background.,The crows crow as a steady wind blows in the background.,development,forest_ambience_copake_winter_1.wav,44100,23.59793650793651,18.21,1.4225519352414668,0.9635371086873726,,0.0,4604.494022168785,948.8789653410345,0.02937143579504314,"",40.243
development/Kitchen-Sink-Drain.wav,/root/clawd/_datasets/clotho_3490684/audio_development/development/Kitchen-Sink-Drain.wav,Water drips into another container of water and then a door squeaks.,Water drips into another container of water and then a door squeaks.,Water drips into another container of water and then an door squeaks.,Water flowing and a door hinge squeaking as a door opens.,Water running and a door hinge grinding as the door opens.,Water trickles out of a faucet and into a drain before it is turned off.,development,Kitchen-Sink-Drain.wav,44100,16.025238095238095,27.13,1.9493545994714567,0.8964359377949169,,0.0,340.9472685027774,190.34904925874352,0.03329086751544697,"",24.196
development/Wooden Door 01.wav,/root/clawd/_datasets/clotho_3490684/audio_development/development/Wooden Door 01.wav,A creaky door hinge opens and closes several times.,A creaky door hinge opens and closes several times.,A door hinge creaks as it opens and closes several times.,A squeaky wooden door that is being opened and closed.,Squeaking and banging noises over and over again.,The noise is squeaking and banging over and over again.,development,Wooden Door 01.wav,44100,18.26167800453515,9.406,2.0577396389908875,3.153426849970926,,11.583917050712003,16976.3244675553,1669.5859177458317,0.012535056611992028,"",10.024
development/Pictured_Rocks_Lake_M_Waves_2.wav,/root/clawd/_datasets/clotho_3490684/audio_development/development/Pictured_Rocks_Lake_M_Waves_2.wav,Cars driving by outside with heavy rain falling.,Cars driving by outside with heavy rain falling.,Hard rain beats down on a surface as the wind produces strong gusts.,It is raining very heavily outside and the cars are passing.,The rain comes in a downpour as a blast of air swells quickly.,"The wind gusts strongly, and hard rain beats down on a surface.",development,Pictured_Rocks_Lake_M_Waves_2.wav,44100,24.661020408163264,38.68,1.8522007033040306,0.49631203114742756,,0.0,2393.1535689443426,407.81598267069734,0.018286854892624497,"",54.754
development/Amsterdam Cityhum at night.wav,/root/clawd/_datasets/clotho_3490684/audio_development/development/Amsterdam Cityhum at night.wav,A high volume of air is generated by one machine as other machinery passes in the background.,A high volume of air is generated by one machine as other machinery passes in the background.,A high volume of air is moving and other machinery is passing in the background.,A strong wind blowing outside of a window with people chatting in the background.,A vehicle engine is running while in muffled road traffic with people talking in the background.,engine and road noise with buffering and background speech,development,Amsterdam Cityhum at night.wav,44100,18.97721088435374,26.03,1.1571499278292767,0.12464158955147765,,0.0,7078.703994146254,720.8019837966505,0.05236541972586716,"",35.741
development/cat_breath.wav,/root/clawd/_datasets/clotho_3490684/audio_development/development/cat_breath.wav,A person is using a file to cut down wood.,A person is using a file to cut down wood.,A person is breathing nearby in cold weather.,Buffering noises sound as an animal makes heavy breathing noises.,Someone is using a rubbing tool to cut wood.,Someone is breathing and making whistling and rattling sounds at a close range again and again in cold weather.,development,cat_breath.wav,44100,20.491609977324263,14.824,1.4712456531467422,0.3576036725661599,,0.0,8692.699481407439,1870.3203691165206,0.020062650823923427,"",25.063
development/forest stick sticks wood hit carpenter woodcutter axe handmade manual work craft crafting handcraft handcrafting 2.wav,/root/clawd/_datasets/clotho_3490684/audio_development/development/forest stick sticks wood hit carpenter woodcutter axe handmade manual work craft crafting handcraft handcrafting 2.wav,In a systematic way one piece of wood strikes another.,In a systematic way one piece of wood strikes another.,One piece of wood striking another piece of wood in a systematic repeated way.,Someone is tapping on a wooden object with rustling in the background.,Wood knocking on wood then a pause and a crash then the knocking continues.,Wood knocks against wood followed by a pause and a crash before the knocking continues,development,forest stick sticks wood hit carpenter woodcutter axe handmade manual work craft crafting handcraft handcrafting 2.wav,44100,29.523174603174603,17.96,1.6065928432070036,4.977639980479467,,0.0,37192.582251516025,2410.1639899837382,0.028628713999384752,"",21.753
development/Night in nature.wav,/root/clawd/_datasets/clotho_3490684/audio_development/development/Night in nature.wav,A bird chirps in a rhythmic and high pitched pattern as insects buzz.,A bird chirps in a rhythmic and high pitched pattern as insects buzz.,A bird chirps in a systematic rhythmic and high pitched pattern as insects buzz.,A bunch of different insects simultaneously chirp noisily,Crickets are chirping in the woods by the stream.,insects calling both near and far in an outdoor setting,development,Night in nature.wav,44100,29.51408163265306,23.28,2.542177875709618,1.5161879007540946,,18.109841508641537,18740.753711861904,788.6024297294135,0.08166270181980989,"",58.607
development/DoorOpenClose-EDITED.wav,/root/clawd/_datasets/clotho_3490684/audio_development/development/DoorOpenClose-EDITED.wav,A door is opened and closed over and over.,A door is opened and closed over and over.,A door opens and then slams shut shortly after.,A screen door is opened and closed numerous times.,Someone opens a door and shuts it twice.,"They were opening and closing the door, and walking around and closing the door.",development,DoorOpenClose-EDITED.wav,44100,16.207528344671204,12.874,1.7970127970348977,1.1381758635470276,,0.0,8863.170383073186,1560.985849129256,0.02051436361434596,"",8.123
development/April dawn chorus Sydenham Hill.wav,/root/clawd/_datasets/clotho_3490684/audio_development/development/April dawn chorus Sydenham Hill.wav,Birds are chirping loudly in the forest while insects are buzzing.,Birds are chirping loudly in the forest while insects are buzzing.,Many birds are chirping in the distance while other animals also make noise.,Many birds chirping in the distance with other animals making noises,Many different birds are chirping and tweeting together.,Several different birds are chirping harmoniously in nature.,development,April dawn chorus Sydenham Hill.wav,44100,23.817709750566895,26.15,2.458422683028086,0.2411929555723342,,0.0,29004.699267940818,1628.51648066998,0.05284645139183727,"",38.743
development/Forest Ambience Danish.wav,/root/clawd/_datasets/clotho_3490684/audio_development/development/Forest Ambience Danish.wav,A variety of birds chirp to one another.,A variety of birds chirp to one another.,Birds chirping back and forth to each other in the background.,Two birds are tweeting and chirping consistently and within rhythm of each other.,Two birds tweet and chirp in a consistent rhythm.,Various birds chirp harmoniously at one another in the trees,development,Forest Ambience Danish.wav,44100,25.745646258503402,14.741,1.9323727774855601,0.7204564504010884,,0.0,45832.875312039025,3463.727633532029,0.054669270835069006,"",38.57
development/RedWingBlackBirdShoppingCenter.wav,/root/clawd/_datasets/clotho_3490684/audio_development/development/RedWingBlackBirdShoppingCenter.wav,Birds are chirping and someone is driving a car quickly down the road.,Birds are chirping and someone is driving a car quickly down the road.,Birds are chirping and whistling as vehicles pass by on the road.,Birds are chirping while cars drive on a roadway.,Birds chirp harmoniously as a car with a loud engine drives by,birds chirping and whistling as vehicles pass by on the road.,development,RedWingBlackBirdShoppingCenter.wav,44100,17.82283446712018,26.35,1.0553976735889605,0.429638858281389,,0.0,3615.5527728806883,438.65461964290336,0.07215310776916124,"",25.152
development/around the yellow Ferrari pt. 1.wav,/root/clawd/_datasets/clotho_3490684/audio_development/development/around the yellow Ferrari pt. 1.wav,A vehicle passing by smoothly then stops abruptly and starts accelerating again.,A vehicle passing by smoothly then stops abruptly and starts accelerating again.,"A whining vehicle interrupts a clattering object, while a strong wind blows.",Cars and trucks passing by on a nearby street.,Vehicles buzz while travelling along a busy street during a windy day.,Vehicles on a nearby street are passing by.,development,around the yellow Ferrari pt. 1.wav,44100,21.678730158730158,21.85,1.2218493934984593,0.12470184286883111,,0.0,8051.236929418385,819.2647840787376,0.04987126766499992,"",35.069
development/Engine-air compressor-090720.wav,/root/clawd/_datasets/clotho_3490684/audio_development/development/Engine-air compressor-090720.wav,A generator running smoothly and then abruptly shutting off.,A generator running smoothly and then abruptly shutting off.,A machine buzzes rhythmically and then comes to a stop with a hiss.,A motor is running and a ticking sound is heard and at the end is a release.,An engine is running constantly before it suddenly stops.,"Before it suddenly stopped, an engine ran constantly.",development,Engine-air compressor-090720.wav,44100,29.56124716553288,16.67,1.5599555749892249,0.36955541844859696,,0.0,1684.7952029816695,486.35243728959506,0.011659330907812336,"",46.194
development/Birds Bees and Wind.wav,/root/clawd/_datasets/clotho_3490684/audio_development/development/Birds Bees and Wind.wav,A bird chirping with a bug buzzing in the foreground.,A bird chirping with a bug buzzing in the foreground.,A bird tweeting with a bug buzzing in the front.,A group of small birds are singing in the background.,"Nature sounds such as birds chirping, wind blowing, and bees buzzing are in the background.",The calm of the park is peaceful as the birds sing and a fly buzzes by.,development,Birds Bees and Wind.wav,44100,15.02578231292517,3.801,1.8884528905401634,0.060505040618868834,,0.0,35956.015309909555,2374.6454237367875,0.0036460626229749566,"",17.54
development/nightinggale2.wav,/root/clawd/_datasets/clotho_3490684/audio_development/development/nightinggale2.wav,An alarm is beeping loudly throughout the audio.,An alarm is beeping loudly throughout the audio.,An insect is screaming continuously without any break,Insects chirp loudly in a peaceful environment at night,The strange alarm chirps like the ringing of a fire alarm.,Throughout the audio an alarm is beating loudly.,development,nightinggale2.wav,44100,25.54687074829932,37.46,2.528092579354741,4.288621454698596,,26.593201894556124,19268.822403291513,578.942958878466,0.2365517426968675,"",49.744
development/Aviary Birds 01.wav,/root/clawd/_datasets/clotho_3490684/audio_development/development/Aviary Birds 01.wav,Different birds are screaming continuously in the nature.,Different birds are screaming continuously in the nature.,Multiple birds are chirping back and forth to each other.,Screaming of different birds continuously in the nature,Two birds are communicating with each other through chirping.,Various birds chirping back and forth to each other at different tone levels.,development,Aviary Birds 01.wav,44100,18.079931972789115,20.21,3.0184228666964126,2.9650382537338267,,0.0,10909.373357785551,646.5815242355028,0.07040317582481694,"",28.747
development/howling wind inside  02 131230_01.wav,/root/clawd/_datasets/clotho_3490684/audio_development/development/howling wind inside  02 131230_01.wav,Air is moving at varying volumes and speeds through an air duct.,Air is moving at varying volumes and speeds through an air duct.,Heavy winds rush through an opening in the door.,"In an air duct, air is moving at many speeds and varying volumes.",Powerful wind gusts and blowing at different intensity levels.,The wind is blowing hard through trees and under the roof.,development,howling wind inside  02 131230_01.wav,44100,29.031768707482993,23.93,0.8515852667404363,0.09078091701842836,,0.0,4224.179038069558,470.4365863316094,0.05422801460519922,"",37.067
development/blackbird.wav,/root/clawd/_datasets/clotho_3490684/audio_development/development/blackbird.wav,A bird chirping in a place with an echo.,A bird chirping in a place with an echo.,"A bird chirps and the chirp gets quieter, and then louder again.",A small bird chirping in a hallway many times .,"In place of an echo, a bird chirped.","The call of a bird repeats, echoing as it bounces off its surroundings.",development,blackbird.wav,44100,19.54716553287982,11.838,3.3012289274735473,0.34322359669282865,,0.0,427045.0852451337,6248.93539221783,0.03891511036496073,"",20.364
development/Silencyo_CC_Field_Cicadas_French Children Playing_Wind_Dog_Distant Traffic.wav,/root/clawd/_datasets/clotho_3490684/audio_development/development/Silencyo_CC_Field_Cicadas_French Children Playing_Wind_Dog_Distant Traffic.wav,A screaming kid is dragged by other kids as crickets squeak in the surroundings.,A screaming kid is dragged by other kids as crickets squeak in the surroundings.,Different species of birds chirp as children laugh in the distance.,Different species of birds rustling and chirping and children talking in the background.,Kids are conversing and yelling while bugs and animals make resonate in the environment,children are talking and screaming while bugs and animals making sounds in the background,development,Silencyo_CC_Field_Cicadas_French Children Playing_Wind_Dog_Distant Traffic.wav,44100,24.8143537414966,31.54,2.0292786531680194,0.4966653342281748,,0.0,2631.5406473532876,676.5369672490424,0.03728066467672031,"",52.993
development/bewicks_wren.wav,/root/clawd/_datasets/clotho_3490684/audio_development/development/bewicks_wren.wav,A variety of birds are chirping and calling while traffic roars passed in the distance.,A variety of birds are chirping and calling while traffic roars passed in the distance.,Birds chirp in a tree while cars drive in the distance.,Several birds singing and chirping with traffic backdrop.,"With a traffic backdrop, several birds are singing and chirping.",birds chirping and talking to each other and cars driving in the distance.,development,bewicks_wren.wav,44100,25.8,27.64,1.8098303173643324,0.4502289161461086,,0.0,412.17967418004366,247.82448795191237,0.035358983758177,"",41.973
development/Summer night storm.wav,/root/clawd/_datasets/clotho_3490684/audio_development/development/Summer night storm.wav,"A heavy downpour of rain is audible, with intermittent strikes of thunder.","A heavy downpour of rain is audible, with intermittent strikes of thunder.",Heavy rain pours down outside with the occasional crack of thunder.,It is raining and then begins to thunder.,The rain falls down heavily while wind are blowing and thunder is rumbling in the background,The wind blows as rain heavily falls to a backdrop of rumbling thunder.,development,Summer night storm.wav,44100,25.69746031746032,21.26,1.8456200100250937,0.19558933506617499,,0.0,53232.22969453917,3299.2498282238857,0.026042545308747538,"",55.456
development/Shower 1.wav,/root/clawd/_datasets/clotho_3490684/audio_development/development/Shower 1.wav,A heavy machine is turned on in a work place,A heavy machine is turned on in a work place,A heavy piece of machinery is turned on in a work place,A sharp whistling is audible and repeats in the background at a high volume.,The constant hiss of steam completely covers any other noises.,The constant hiss of steam completely masks any other noises.,development,Shower 1.wav,44100,15.255963718820862,38.6,2.782964683254556,0.14940204531614115,,0.0,317.4455918880215,126.94714818843497,0.030788516178037732,"",36.829
development/Freeway traffic moving at the speed limit(Overhead).wav,/root/clawd/_datasets/clotho_3490684/audio_development/development/Freeway traffic moving at the speed limit(Overhead).wav,A car is passing by alongside a motorcycle.,A car is passing by alongside a motorcycle.,A car is passing by and a motorcycle passes too.,A motorcycle and other traffic are passing in close proximity to each other.,A motorcycle and other traffic passing in close proximity to each other.,Rain coming down on a busy highway with a motorcycle going past.,development,Freeway traffic moving at the speed limit(Overhead).wav,44100,23.971451247165533,29.24,1.1968884641938797,1.0376804315397583,,0.0,3397.190892389936,464.29657616351795,0.022316703600264585,"",40.879
development/Ljubljana-2.wav,/root/clawd/_datasets/clotho_3490684/audio_development/development/Ljubljana-2.wav,A group of people talk while birds chirp alongside them in the background.,A group of people talk while birds chirp alongside them in the background.,A group of people talking and also birds chirping in the background.,"Men and women speak in a crowded, outdoor area.",Men and women talk to each other in a crowded outdoor area.,"Men and women talk, while a bird chirps in the background.",development,Ljubljana-2.wav,44100,18.082403628117913,19.3,1.4133717203358818,1.3052874937506396,,0.0,13160.945190390323,1279.8143578460679,0.028345619734090634,"",28.396
development/InsectsSummerSwellingAug16th2013.wav,/root/clawd/_datasets/clotho_3490684/audio_development/development/InsectsSummerSwellingAug16th2013.wav,A bunch of birds are chirping and tweeting,A bunch of birds are chirping and tweeting,A lot of insects outside on a summer night.,Crickets in the woods chirp in the middle of the night.,The woods in the middle of the night with crickets in the trees.,"Tweeting and chirping, the bunch of birds carried on.",development,InsectsSummerSwellingAug16th2013.wav,44100,18.343809523809522,35.06,2.658911988733261,0.5257463562594206,,0.0,307.97127414776253,135.69290269889257,0.02183818760320676,"",39.689
development/birds_serres_Auteuil.wav,/root/clawd/_datasets/clotho_3490684/audio_development/development/birds_serres_Auteuil.wav,Birds are chirping and someone is firing shots in the background,Birds are chirping and someone is firing shots in the background,Birds chirping while people move things around and talk in the background.,Birds in a zoo are chirping as their cage door are being opened and closed.,Someone is talking and birds are chirping inside a building.,"While birds chirp, people move things and talk in the background.",development,birds_serres_Auteuil.wav,44100,28.73766439909297,20.89,1.9054063586693093,1.100797022605205,,0.0,39221.89296280505,2567.74772067551,0.03896278440873193,"",47.54
development/motorway ambient background.wav,/root/clawd/_datasets/clotho_3490684/audio_development/development/motorway ambient background.wav,Background traffic hisses by while in the foreground someone is shuffling equipment.,Background traffic hisses by while in the foreground someone is shuffling equipment.,Background traffic hisses by while someone shuffles equipment in the foreground.,Cars are passing by very fast on the road while a plane passes overhead.,Machinery makes a muffled noise as wind gusts strongly.,Traffic of different kinds of vehicles are moving nearby.,development,motorway ambient background.wav,44100,23.75485260770975,34.97,1.2785682660669122,0.8219592884037911,,0.0,1068.8064112708291,364.1855690774833,0.028894657913812547,"",41.833
development/Short room tone from a medium sized house room.wav,/root/clawd/_datasets/clotho_3490684/audio_development/development/Short room tone from a medium sized house room.wav,A person shuffling about in a room as a fan blows.,A person shuffling about in a room as a fan blows.,A trash bag is being shaken open while a dog barks.,"As a fan blows, a person shuffles about in a room.",Someone is shaking a trash bag open as a dog barks.,Someone is using a broom and performing cleaning tasks.,development,Short room tone from a medium sized house room.wav,44100,19.59981859410431,31.85,1.5753309558989461,0.6261635016957992,,0.0,1365.6690613185028,265.71803963226876,0.05166229719247425,"",41.554
development/Walking across carpeted floor with slippers.wav,/root/clawd/_datasets/clotho_3490684/audio_development/development/Walking across carpeted floor with slippers.wav,Hard papers being ripped in pieces one after another,Hard papers being ripped in pieces one after another,He is tearing down the sides of something within the house.,Someone sweeping the floor with a broom very loud.,hard papers are being ripped in pieces one after another,tearing down the sides of something in a house,development,Walking across carpeted floor with slippers.wav,44100,15.777959183673469,26.32,1.9094944925288422,0.8291355124641094,,0.0,9510.020069324251,818.0574990801231,0.054380968448371675,"",28.822
