id,audio_path,text,caption_1,caption_2,caption_3,caption_4,caption_5,split,file_name,sample_rate,duration_s,loudness,sharpness,roughness,fluctuation_strength_proxy,pr_ecma_st,fluctuation_evr,fluctuation_ami,fluctuation_rms_mod,error,compute_time_s
development/train_arrival.wav,/root/clawd/_datasets/clotho_3490684/audio_development/development/train_arrival.wav,A number of trains are moving in the local area at different speeds and passing each other.,A number of trains are moving in the local area at different speeds and passing each other.,A number of trains pass each other as they are moving in the local area at different speeds.,A vehicle engine starts up and then accelerates and drives off becoming quieter as it goes into the distance,"An engine starts then revs before driving away and approaching again, then it leaves again with tapping in the background.",a train is going slowly while a car is going really fast,development,train_arrival.wav,44100,19.473378684807255,25.91,1.4310855017201947,0.10742034006132235,,0.0,105358.84423986399,3745.4469152681345,0.035111088169359365,"",32.881
development/two trains-casablanca.wav,/root/clawd/_datasets/clotho_3490684/audio_development/development/two trains-casablanca.wav,A long train passes by as it blows its horn.,A long train passes by as it blows its horn.,A train with a lot of cars going past a location at a very fast pace blowing its horn.,The horn of a train blows as it continues rolling on the tracks,The horn of a train goes off as it continues rolling on the tracks,Cars and trains are honking and speeding by quickly.,development,two trains-casablanca.wav,44100,22.89544217687075,29.4,1.356827774703679,0.4099263316860431,,0.0,2664.639778396898,375.3999815665945,0.05025947954824428,"",43.323
development/Market environment.wav,/root/clawd/_datasets/clotho_3490684/audio_development/development/Market environment.wav,A crowd of adults and children are talking to each other,A crowd of adults and children are talking to each other,A crowd of adults and children talking to each other,A crowd of people are talking and a little kid speaks clearly.,A little kid speaks up clearly while a crowd of people are talking.,A train station is busy as people are talking to each other.,development,Market environment.wav,44100,23.417324263038548,33.25,1.1804068082612278,0.2893381969177049,,0.0,3241.4770720857314,479.85787311980505,0.03923365519193031,"",42.536
development/Morning Ride 1.wav,/root/clawd/_datasets/clotho_3490684/audio_development/development/Morning Ride 1.wav,A motor is running at a steady pace.,A motor is running at a steady pace.,An engine is running at a smooth and steady pace.,An old truck in a driveway is idling.,An old truck was idling in a driveway.,"Many engine sounds with clattering, vibration and chugging noises.",development,Morning Ride 1.wav,44100,24.431768707482995,64.49,1.6957701116537152,1.4129853340972758,,0.0,2058.0992783051634,320.2363875311573,0.08604797920887525,"",51.308
development/Motorcycle 2.wav,/root/clawd/_datasets/clotho_3490684/audio_development/development/Motorcycle 2.wav,A large motorcycle that is being revved up.,A large motorcycle that is being revved up.,A motorcycle engine idles and then the engine revs several more times.,A motorcycle engine idles and then the engine revs several times.,A tractor engine with a faulty drive belt is being revved repeatedly as the belt flaps around.,A tractor engine with a faulty drive belt is revved over and over again as the belt flaps around.,development,Motorcycle 2.wav,44100,19.42045351473923,66.13,1.7613391855188123,1.432729199572755,,0.0,2042.3347076061282,267.0272542883224,0.10212722426719983,"",41.014
development/WalkingThroughLeaves1.wav,/root/clawd/_datasets/clotho_3490684/audio_development/development/WalkingThroughLeaves1.wav,A person is walking through a lot of leaves making a crunching sound.,A person is walking through a lot of leaves making a crunching sound.,A person walking through a lot of leaves is causing a crunching sound.,A person walks through the dry Fall leaves on the ground.,A person is marching on some leaves outside.,The person walking threw the leaves gets louder and louder.,development,WalkingThroughLeaves1.wav,44100,25.089160997732428,21.04,2.6315182717369314,2.0610431883528046,,0.0,19721.751858937016,2236.6562384986037,0.050463484857582716,"",51.178
development/Cityscape 03 090617.wav,/root/clawd/_datasets/clotho_3490684/audio_development/development/Cityscape 03 090617.wav,A quiet and faint consistent humming in the background.,A quiet and faint consistent humming in the background.,A quiet and faint consistent humming is in the background.,"In the distance, a passenger train is on the tracks.",The ambience of a building reverberates against the walls.,an engine is whirring and someone is sharpening a knife in the back,development,Cityscape 03 090617.wav,44100,24.363809523809525,5.891,0.8633619974536032,0.11136231993015373,,0.0,4616.818518345689,752.4821676791954,0.0823252135652578,"",26.795
development/outdoors ambient distant village.wav,/root/clawd/_datasets/clotho_3490684/audio_development/development/outdoors ambient distant village.wav,"Birds are chirping, a car honks, and people talk softly.","Birds are chirping, a car honks, and people talk softly.","Birds are chirping, a car honks, and several people talk softly.","Birds chirping, dogs barking, and wind blowing create a summer ambience.",traffic noises while voices yelling and dogs barking,traffic noises with voices and dogs barking in the distance,development,outdoors ambient distant village.wav,44100,29.205487528344673,10.13,1.328171697174937,0.23054905690121152,,0.0,64384.31791903029,2325.4169181276034,0.06691060133652733,"",44.198
development/Fridge Door.wav,/root/clawd/_datasets/clotho_3490684/audio_development/development/Fridge Door.wav,A machine is running continuously at the same speed.,A machine is running continuously at the same speed.,A object is thrown inside the trash and food is chopped.,A object is thrown inside the trash while food is being chopped.,"A scraping is done, then a series of repetitive thuds and squeaks sound before more scraping.","An scraping is done, then a series of repetitive thuds and squeaks sound before more scraping.",development,Fridge Door.wav,44100,23.21065759637188,8.284,1.5560201440832435,1.5556224142089146,,0.0,124.30137318935982,346.9565334241912,0.015520733472123682,"",23.102
development/Compressor_Motor.wav,/root/clawd/_datasets/clotho_3490684/audio_development/development/Compressor_Motor.wav,A heavy machine gas operated generator running on idle,A heavy machine gas operated generator running on idle,"A large motor is idling, with rhythmic vibration.",A large motor with rhythmic vibration is idling.,"A rather heavy machine operated generator, run by gas, is running idle.",An air compressor running at a constant speed over time.,development,Compressor_Motor.wav,44100,18.565102040816328,44.81,1.4329712545976738,0.26258472108819464,,0.0,1076.5078435556493,183.80076215103938,0.051496161489297566,"",39.564
development/train boat.wav,/root/clawd/_datasets/clotho_3490684/audio_development/development/train boat.wav,A large helicopter running at a fair distance near an airplane field.,A large helicopter running at a fair distance near an airplane field.,"A soft, mechanical whir grows into a loud rumble while wind blows in the background",A tractor clearing dirt across a construction site.,"An air compressor running under constant load, then it slows down.",An air compressor runs under a steady load and then slows down.,development,train boat.wav,44100,27.481133786848073,36.04,1.1733887636774925,1.0553399366969476,,0.0,17139.818442821415,990.6864861620882,0.03714489764204288,"",46.262
development/drill.wav,/root/clawd/_datasets/clotho_3490684/audio_development/development/drill.wav,"A loud screeching, almost static, noise emits from the running motor","A loud screeching, almost static, noise emits from the running motor",A machine rotates around and makes a high pitched buzzing.,As a machine rotates around and it makes a high pitched buzzing.,Loud motor running creating a static and screeching sound.,Someone is sawing a long board with a table saw.,development,drill.wav,44100,24.54122448979592,41.44,2.1289667114197006,0.0936119758837111,,0.0,500.0795571345198,211.23935722791526,0.023829651576219458,"",55.834
development/Household - Rain on Conservatory Roof.wav,/root/clawd/_datasets/clotho_3490684/audio_development/development/Household - Rain on Conservatory Roof.wav,A heavy rain is coming down on a roof and falling to the ground.,A heavy rain is coming down on a roof and falling to the ground.,It is raining and hailing on a tin roof.,It is raining and hailing on top of a tin roof.,Water flows at a medium and constant rate.,Water is going at a steady and constant rate of motion.,development,Household - Rain on Conservatory Roof.wav,44100,27.5318820861678,43.67,1.7467800593276788,0.11486781956891436,,0.0,2497.080690121196,334.47839689660617,0.021355213635321085,"",60.792
development/Waterheater.wav,/root/clawd/_datasets/clotho_3490684/audio_development/development/Waterheater.wav,It is raining and hailing and it gets harder before it gets softer.,It is raining and hailing and it gets harder before it gets softer.,Rain and hail grow harder and louder but then lets up.,Rain quickly began to fall on the roof.,Rain was falling on a metal pipe and it slowed down,Rain was falling on a metal pipe then it slowed down.,development,Waterheater.wav,44100,27.78938775510204,27.08,1.6924435928525647,0.3944097392689623,,0.0,4427.552376025892,1264.111744911024,0.011987198844378159,"",54.271
development/Rain_Falling_On_Ground.wav,/root/clawd/_datasets/clotho_3490684/audio_development/development/Rain_Falling_On_Ground.wav,It is either raining or a shower is turned lightly on somewhere.,It is either raining or a shower is turned lightly on somewhere.,Rain falling onto a roof and down a gutter and metal being struck by a hard object in the background.,The rain falls onto the roof and then down the gutter as an object strikes metal in the background.,Water is raining down lightly at a normal rate.,Water rains down lightly at a steady pace.,development,Rain_Falling_On_Ground.wav,44100,25.756054421768706,12.379,2.578396609181713,2.1278828718857805,,0.0,837.7042682133223,232.785080093191,0.003241848749817765,"",54.416
development/rotating sprinkler.wav,/root/clawd/_datasets/clotho_3490684/audio_development/development/rotating sprinkler.wav,A machine runs softly as thunder rumbles in the distance.,A machine runs softly as thunder rumbles in the distance.,A mechanical device continues quietly amid rolling thunder far away.,A motor is running real fast at first and then normal.,A sprinkler is spraying water very quickly then slows slightly to an even pace,A sprinkler sprays water at a fast pace before slowing down.,development,rotating sprinkler.wav,44100,20.096507936507937,5.634,1.5836486836053658,0.8065096571420598,,0.0,6263.5992023375275,1207.258743668703,0.06616496203278664,"",25.008
development/Under the metal roof while raining.wav,/root/clawd/_datasets/clotho_3490684/audio_development/development/Under the metal roof while raining.wav,A storm progresses while rain and hail hit a roof.,A storm progresses while rain and hail hit a roof.,Hail is falling on a tin metal roof and the wind is blowing debris.,Hail is falling on a tin metal roof and wind is blowing.,Rain and hail falling on a roof during a storm.,Several hard pieces rattle around in a clothes dryer as it spins.,development,Under the metal roof while raining.wav,44100,24.86138321995465,21.91,1.7500965210338895,1.2579907861535005,,0.0,11223.956362346551,1170.9313911163026,0.02695723495663174,"",49.127
development/Rain Rain.wav,/root/clawd/_datasets/clotho_3490684/audio_development/development/Rain Rain.wav,A shower was running the whole clip with no other sounds present.,A shower was running the whole clip with no other sounds present.,A rainfall continues at a steady pace for twenty seconds.,The only sound on the whole clip was a shower running.,Water running in a waterfall or pan frying or cooking in oil.,a steady fall of rain continues for twenty seconds.,development,Rain Rain.wav,44100,20.31122448979592,5.094,3.2888414095151326,0.12678381556510734,,0.0,208.5291241155987,148.3408187650837,0.0010151402338599272,"",33.193
development/step_sound.wav,/root/clawd/_datasets/clotho_3490684/audio_development/development/step_sound.wav,A person is walking on hard surface such as pavement or concrete.,A person is walking on hard surface such as pavement or concrete.,A person walking on a hard surface like pavement or concrete.,About twenty or so footsteps that become softer as time goes on,Someone is making their way down a long flight of stairs.,Someone walking down a long flight of stairs.,development,step_sound.wav,44100,15.455600907029478,6.46,1.5578375671735951,4.068080950410692,,0.0,4014.2510902083027,730.5134926753043,0.009784571943019857,"",15.121
development/House Keys pack SFX.wav,/root/clawd/_datasets/clotho_3490684/audio_development/development/House Keys pack SFX.wav,Jingling keys move around on a key ring.,Jingling keys move around on a key ring.,Keys are jingling and being moved around a key ring.,Small metal objects are being moved and dropped against another hard surface.,Small metal objects being moved and dropped against another hard surface.,Someone is spinning a set of keys around their finger.,development,House Keys pack SFX.wav,44100,15.660498866213151,9.757,3.367080937999812,3.2440784864698786,,0.0,77697.36247426746,2717.8052286737757,0.02568785773772789,"",15.022
development/lead.wav,/root/clawd/_datasets/clotho_3490684/audio_development/development/lead.wav,A long buzz is interrupted by static and lower tones.,A long buzz is interrupted by static and lower tones.,Long buzzing stops then static starts before the lower tones.,Loud feedback from a large chime or mechanical unit.,"Loud, almost feedback type from a large chime or mechanical unit.",Someone is driving through a car wash to clean their car.,development,lead.wav,44100,26.895056689342404,71.54,1.1927229464133318,2.6938914490551875,,0.0,377.53295378058704,192.56856217253053,0.11140985630936087,"",55.433
development/Printer Setting Up.wav,/root/clawd/_datasets/clotho_3490684/audio_development/development/Printer Setting Up.wav,A car door opens while the engine hums at a low level.,A car door opens while the engine hums at a low level.,A printer head moving back and forth on its bar,Mechanical buzzing precedes and follows the closing of a door.,The electronic driver system is being adjusted by the driver.,The printer head moves back and forth while printing.,development,Printer Setting Up.wav,44100,25.536009070294785,6.277,1.4844767269998826,0.4518964610558131,,0.0,4129.144286157439,1394.950808589387,0.003995125356088816,"",16.422
development/scraping seeds from a squash.wav,/root/clawd/_datasets/clotho_3490684/audio_development/development/scraping seeds from a squash.wav,A bottle opening precedes a lot of crunching.,A bottle opening precedes a lot of crunching.,A door opens and closes along with walking around stepping sounds.,A mechanical bottle opening precedes some loud crunching.,A metal object striking and scraping against another metallic surface.,Two metallic objects are scraping against each other.,development,scraping seeds from a squash.wav,44100,20.95863945578231,13.807,2.1401321737064425,2.9294417043473406,,0.0,8887.834916770937,1756.7476956059506,0.022994895763442068,"",29.972
development/like a jet aircraft landing.wav,/root/clawd/_datasets/clotho_3490684/audio_development/development/like a jet aircraft landing.wav,A high pitched screech gets louder until it fades out.,A high pitched screech gets louder until it fades out.,An airplane beginning to take off and off into the air.,"As they operate, the machines whir loudly and increase in volume.","Before fading out, the high pitched screech grows louder.",Machines whir loudly and increase in noise as they operate.,development,like a jet aircraft landing.wav,44100,24.026938775510203,40.61,2.462958383798295,0.12686558882751583,,0.0,1449285.9495368132,14823.801660410609,0.024673849372095664,"",49.82
development/APPROACHING_STORM_2_0809_183204.wav,/root/clawd/_datasets/clotho_3490684/audio_development/development/APPROACHING_STORM_2_0809_183204.wav,A distant voice and chirping while the wind blows strongly.,A distant voice and chirping while the wind blows strongly.,Distant chirping with wind distortion and a very distant voice.,The cicadas continue to chirp as the wind and thunder picks up.,Thunder gets louder and louder as bugs hiss.,Wind and thunder picks up as cicadas release their chirps,development,APPROACHING_STORM_2_0809_183204.wav,44100,28.110884353741497,10.797,1.3102661584210267,0.9586673857863316,,0.0,429737.89273735613,11107.707196832416,0.036961629788108186,"",19.072
development/winter wren wind leaves.wav,/root/clawd/_datasets/clotho_3490684/audio_development/development/winter wren wind leaves.wav,A bird is chirping repeatedly in the background.,A bird is chirping repeatedly in the background.,A couple birds chirp back and forth at each other,A couple of birds chirp back and forth at each other,A small bird that is locked in a cage chirping.,In the background a bird is repeatedly chirping.,development,winter wren wind leaves.wav,44100,23.49920634920635,19.14,2.9156349472508865,0.6150537356712267,,17.509911743025107,28384.18791783076,1152.8641157569677,0.062311271615271786,"",44.684
development/recycling paper.wav,/root/clawd/_datasets/clotho_3490684/audio_development/development/recycling paper.wav,A person slams a squeaky metal door closed,A person slams a squeaky metal door closed,A person slams an squeaky metal door closed.,A squeaky cage is opening and closing loudly.,Someone keeps opening and closing a locker door over and over repeatedly.,Someone opening and closing a locker door repeatedly over and over.,development,recycling paper.wav,44100,19.005532879818595,20.41,2.028462080026077,1.6221727980715575,,9.300256059892803,2578.2031723148816,723.1369607589487,0.050228320627648426,"",28.76
"development/, iannaeneee iiaca, caienu niaoe iaao aaaiiaie, nooe eie n, oi e naeno aaoa ia neiinoe, caii eaaaaoia iiiineon.wav","/root/clawd/_datasets/clotho_3490684/audio_development/development/, iannaeneee iiaca, caienu niaoe iaao aaaiiaie, nooe eie n, oi e naeno aaoa ia neiinoe, caii eaaaaoia iiiineon.wav",A passenger is riding a city commuter train,A passenger is riding a city commuter train,A train rattles the tracks as it passes over them.,"Similar to the train running down the tracks, something is moving.",Something moving similar to the train down the tracks.,The train tracks are rattling when the train goes over them.,development,", iannaeneee iiaca, caienu niaoe iaao aaaiiaie, nooe eie n, oi e naeno aaoa ia neiinoe, caii eaaaaoia iiiineon.wav",44100,23.860861678004536,21.98,1.201285847487182,0.3031928833672931,,0.0,3803.350273988334,626.9325141651144,0.03259251419961885,"",38.163
development/TidalBarrage.wav,/root/clawd/_datasets/clotho_3490684/audio_development/development/TidalBarrage.wav,A commuter train is driving through the rain.,A commuter train is driving through the rain.,A commuter train is carrying people in the rain.,A waterfall flows over rocks as the wind blows.,As the train passes by the rain hits hard.,It is raining real hard as a train passes by.,development,TidalBarrage.wav,44100,18.1856462585034,40.22,1.6110400860294793,0.12777202208120117,,0.0,468.3198927592575,187.12381243143182,0.03069107200847701,"",39.978
development/helicopter4_distant.wav,/root/clawd/_datasets/clotho_3490684/audio_development/development/helicopter4_distant.wav,BIRDS ARE CHIRPING WHILE A MACHINE IS IN USE,BIRDS ARE CHIRPING WHILE A MACHINE IS IN USE,Birds chirp while a helicopter motor and blades hum.,"Helicopter blades turn, followed by the chirping of birds.",The motor of a helicopter and blades hum while birds chirp,"While a machine is in use, birds are chirping.",development,helicopter4_distant.wav,44100,15.433628117913832,11.469,0.6713643153985484,0.7736845843542873,,0.0,9307.856186437572,602.9144368809342,0.0666365315601202,"",15.483
development/Creak of metal gate.wav,/root/clawd/_datasets/clotho_3490684/audio_development/development/Creak of metal gate.wav,Hard metal objects striking and being scraped against a thin tin object.,Hard metal objects striking and being scraped against a thin tin object.,Hard metal objects striking and scraping against a thin tin object.,Metal clanging and metal hinges opening and shutting,Metal hinges being worked and made to creek and squeak while metal clatters.,Someone opening a metal gate and then closing it.,development,Creak of metal gate.wav,44100,24.427392290249433,19.74,1.811963998061756,1.188474535010484,,0.0,7547.906726702032,1778.9103590647526,0.029062470787458727,"",25.654
development/Horny_Cats-Barking_Dog-Bird_GaryBard.wav,/root/clawd/_datasets/clotho_3490684/audio_development/development/Horny_Cats-Barking_Dog-Bird_GaryBard.wav,A baby is crying as a dog is barking at the background.,A baby is crying as a dog is barking at the background.,A cat is crying and a dog is barking.,A cat is meowing in the background as a dog barks.,A dog is barking and a cat is meowing in the background,a cat that is crying and a dog barking,development,Horny_Cats-Barking_Dog-Bird_GaryBard.wav,44100,25.274920634920633,18.51,1.1089516374120068,0.22324146398365752,,0.0,669763.375298462,8874.092744501853,0.0419281608496692,"",31.552
development/fire_engine_patrolling.wav,/root/clawd/_datasets/clotho_3490684/audio_development/development/fire_engine_patrolling.wav,A bell is chiming while moving in a stream of traffic.,A bell is chiming while moving in a stream of traffic.,"A city trolley car dings along, first coming, then going away.",A stream of traffic moves by while a bell chimes.,The bell on a trolley car rings and it gets louder as it passes by and then it fades.,The ringing bell on a trolley car gets louder as it passes by and then fades.,development,fire_engine_patrolling.wav,44100,24.162902494331068,33.96,1.4635407196974575,0.15757208048202984,,20.60465736731292,6865.200423842163,661.2003707960849,0.054438186096635845,"",33.48
development/wind_howl2_mono.wav,/root/clawd/_datasets/clotho_3490684/audio_development/development/wind_howl2_mono.wav,"On a windy day, howling gusts of wind blow.","On a windy day, howling gusts of wind blow.",Wind is whistling as it blows rapidly across the earth.,Winds blow at high speeds creating a whistling effect,Winds create a whistling effect as it blows at high speeds,wind is whistling as it blows quickly across the earth,development,wind_howl2_mono.wav,44100,16.732879818594103,20.69,1.0252362215861537,0.8740085398040747,,0.0,1856.4780260968178,475.2069346884936,0.038067186520314,"",18.568
development/Ravens.wav,/root/clawd/_datasets/clotho_3490684/audio_development/development/Ravens.wav,A group of ducks and some other birds are making noise.,A group of ducks and some other birds are making noise.,A multitude of crows are cackling and song birds are singing in the background.,Birds in the forest are squawking and cawing loudly.,Many crows are cackling and song birds are singing in the background.,birds are squawking and cawing in the forest,development,Ravens.wav,44100,21.84596371882086,29.86,1.472708622169858,0.1507966270992775,,0.0,2082.604644018797,306.25313039869314,0.03853631984328541,"",38.687
development/The return of spring.wav,/root/clawd/_datasets/clotho_3490684/audio_development/development/The return of spring.wav,A multitude of birds chirping covers a few children talking quietly.,A multitude of birds chirping covers a few children talking quietly.,"As a woman speaks, birds are chirping loudly.",Birds are chirping loudly and a woman speaks.,Birds chirping in a tree with children talking in the distance.,The birds are chirping in a tree and children are talking in the distance.,development,The return of spring.wav,44100,25.855419501133788,28.04,2.4088392526546407,1.367551944966286,,0.0,54840.22077318274,1497.7497468791203,0.07772718736745093,"",52.305
development/glass (4).wav,/root/clawd/_datasets/clotho_3490684/audio_development/development/glass (4).wav,A metal object being pulled across the surface of another metal object and another machine running in the background.,A metal object being pulled across the surface of another metal object and another machine running in the background.,A metal object is being pulled across the surface of another and a machine is running in the background.,A sharp tune of a instrument with high notes.,Someone plays a long note on a musical instrument.,Someone sharply plays high notes on an instrument.,development,glass (4).wav,44100,24.555102040816326,23.76,1.5630861213814642,0.11619135641493923,,34.07005953617799,3731.1471107419566,496.1611373789565,0.11830633139993718,"",38.942
development/110911_german_Junkers_52_motorplane_in_rain_.wav,/root/clawd/_datasets/clotho_3490684/audio_development/development/110911_german_Junkers_52_motorplane_in_rain_.wav,A plane is flying in the sky and passing by.,A plane is flying in the sky and passing by.,A plane passed overhead as I came out the door.,"A propeller operated plane is flying overhead, creating a deep dull roar.",A vehicle is continuously running at the same speed.,Near the airport many airplanes fly overhead and in the distance.,development,110911_german_Junkers_52_motorplane_in_rain_.wav,44100,24.167891156462584,19.28,0.675881805021786,0.3465567460385784,,0.0,3131.640231642859,471.56995495035324,0.036732756541642896,"",26.35
