id,audio_path,text,caption_1,caption_2,caption_3,caption_4,caption_5,split,file_name,sample_rate,duration_s,loudness,sharpness,roughness,fluctuation_strength_proxy,pr_ecma_st,fluctuation_evr,fluctuation_ami,fluctuation_rms_mod,error,compute_time_s
development/Room-tone kitchen fridge 150915_0773.wav,/root/clawd/_datasets/clotho_3490684/audio_development/development/Room-tone kitchen fridge 150915_0773.wav,A belt is turning on a conveyor belt continuously.,A belt is turning on a conveyor belt continuously.,A conveyor belt continuously slides along its course.,A conveyor belt runs some line of cargo.,A machine is operating during a production time,"As items are produced on a line, a machine operates.",development,Room-tone kitchen fridge 150915_0773.wav,44100,22.041995464852608,30.03,1.3727940554156943,0.18134622117967622,,0.0,1997.5683638882351,378.61551369920505,0.04080183095717944,"",43.567
development/freesound.wav,/root/clawd/_datasets/clotho_3490684/audio_development/development/freesound.wav,A radio emits static as someone tries to tune it to a station.,A radio emits static as someone tries to tune it to a station.,Intermittent music and music recording from an instrument,Someone using a radio and turning the station with white noise.,Static from a television that gets louder and it changes stations,"Static noise coming from radio tuning with intermittent recognizable music, voice, or both.",development,freesound.wav,44100,25.46,24.75,1.5800442438961282,3.3123194915569005,,0.0,785536.3405480322,13636.775379388982,0.055404247734575945,"",41.352
development/freezer_inside.wav,/root/clawd/_datasets/clotho_3490684/audio_development/development/freezer_inside.wav,An airplane motor is running and the plane is getting farther away.,An airplane motor is running and the plane is getting farther away.,An engine is grinding with constant speed and suddenly stops.,"An engine runs continually, followed by a sharp knock.",A person works with an airplane motor running and sees a plane getting farther away.,The engine grinds with constant speed until suddenly stopping.,development,freezer_inside.wav,44100,15.418049886621315,27.66,1.196605145212138,0.10586345915015945,,0.0,375936.2388870024,12978.293367597225,0.04232079751897335,"",24.896
development/THE_RATT23_1.wav,/root/clawd/_datasets/clotho_3490684/audio_development/development/THE_RATT23_1.wav,A person is using a shovel to clear out snow on the pavement.,A person is using a shovel to clear out snow on the pavement.,A person walking on gravel outside next to a road.,"Sitting by the window, someone sees a person strolling on the gravel next to the road.",Someone is wearing boots and walking through the soft snow.,Someone wearing boots and walking through some soft snow.,development,THE_RATT23_1.wav,44100,25.092290249433105,22.39,1.6734764331903573,2.403224356675739,,0.0,8639.23187710113,883.3839197680516,0.0258359102308722,"",43.381
development/fu-rin_train.wav,/root/clawd/_datasets/clotho_3490684/audio_development/development/fu-rin_train.wav,A train passes by on railroad tracks while people talk nearby.,A train passes by on railroad tracks while people talk nearby.,As the train moves down the tracks it is accompanied by a metallic jingling and friendly conversations.,People on the train are talking while it is travelling.,a train is travelling while people on it are talking,inside a train people talking to each other,development,fu-rin_train.wav,44100,24.282448979591837,20.43,1.3648965608425327,0.32895413386587696,,9.363793146962308,2881.8048910109414,382.59909554767887,0.0864513658658419,"",40.005
development/indianfeelings.wav,/root/clawd/_datasets/clotho_3490684/audio_development/development/indianfeelings.wav,A car is honking and people are moving in a market.,A car is honking and people are moving in a market.,Friendly singing is nearly drowned out by busy city noises.,Noise from the busy city nearly drowned out the friendly singing.,People move about in a market while a car honks.,The ringing of a train signal as a train approaches and music on a loud speaker.,development,indianfeelings.wav,44100,17.856145124716555,36.53,1.342170912791239,0.6252320668755568,,0.0,6785.81480948372,724.3730634464421,0.030164570404704716,"",32.986
development/Woodland Walk Through Leaves.wav,/root/clawd/_datasets/clotho_3490684/audio_development/development/Woodland Walk Through Leaves.wav,A person is walking through a large pile of leaves.,A person is walking through a large pile of leaves.,The footsteps of a person as they walk along a gravel trail.,Footsteps of a person walking along a gravel trail,"Shoes are moving across a surface composed of gravel, twigs and leaves.",Snow crunches as someone walks through the snow.,development,Woodland Walk Through Leaves.wav,44100,16.651995464852607,14.917,2.254273266031218,3.284969120135152,,0.0,21599.541293108174,957.2452061684668,0.017018490018909472,"",30.761
development/Machine Hum Clean.wav,/root/clawd/_datasets/clotho_3490684/audio_development/development/Machine Hum Clean.wav,"A vibrating metallic hum is constant, then a thud occurs.","A vibrating metallic hum is constant, then a thud occurs.",A welding machine cutting a piece of metal,Someone is operating heavy machinery and moving stuff around.,"The activity fills the air with a cacophony of clanging, buzzing, and banging.",a piece of metal gets sliced by a welding torch,development,Machine Hum Clean.wav,44100,16.389931972789114,14.711,1.301950418961042,0.08595213305559374,,0.0,36100.35140495589,2572.293199434166,0.04000717167661975,"",21.527
development/rain_near_smooth.wav,/root/clawd/_datasets/clotho_3490684/audio_development/development/rain_near_smooth.wav,A bunch of rainfall that will not stop in a while.,A bunch of rainfall that will not stop in a while.,A loud rainstorm that does not seem to be dying down.,Rain is falling down continuously outside at a medium pace.,Rain is falling down outside at a continuous medium pace.,Water is pouring down and thunder occurs a couple of times.,development,rain_near_smooth.wav,44100,28.135646258503403,20.68,1.6008131502137175,1.7614589265475817,,0.0,66019.1234012825,4432.846474400141,0.03177923694418549,"",60.349
development/Gentle rain plastic roof and metal pipes.wav,/root/clawd/_datasets/clotho_3490684/audio_development/development/Gentle rain plastic roof and metal pipes.wav,An vague din among a patter of raindrops.,An vague din among a patter of raindrops.,"In the foreground, intermittent droplets of rain hit the window, while a steady rain is falling in the background.",Rain falls steadily and creates a tapping noise as it hits the roof.,Steady rain is falling in the background while intermittent droplets of rain falls in the foreground.,The steadily falling rain rhythmically taps the roof.,development,Gentle rain plastic roof and metal pipes.wav,44100,21.623219954648526,13.972,1.8677587001883253,0.9701669930846404,,0.0,5394.791064736924,741.0453073816698,0.009946047714760264,"",42.239
development/Old Oak Common sidings.wav,/root/clawd/_datasets/clotho_3490684/audio_development/development/Old Oak Common sidings.wav,A car is whirring while a cow is mooing and water is dripping and birds are chirping in the background.,A car is whirring while a cow is mooing and water is dripping and birds are chirping in the background.,Outside traffic and vague honking of horns from other vehicles.,Outside traffic with vague horn honking from other vehicles.,The wind is howling over a long whistle and car horns.,The wind is howling over a long whistles and car horns.,development,Old Oak Common sidings.wav,44100,23.114489795918367,30.54,1.1322902541498283,1.0967632444960131,,0.0,1474.7668417955622,301.24620409312115,0.03588781239870932,"",40.772
development/wooden_Door_slamming_small_room.wav,/root/clawd/_datasets/clotho_3490684/audio_development/development/wooden_Door_slamming_small_room.wav,A loud clanking sound repeats about five times.,A loud clanking sound repeats about five times.,Heavy shuffles were followed by several consecutive clicks.,Heavy shuffling is followed by a click several times consecutively.,Someone is opening and closing a car door.,clanking noise that is continuously playing about five times.,development,wooden_Door_slamming_small_room.wav,44100,20.131700680272107,19.65,1.7318421177052874,3.491392782953637,,0.0,6665.894072687058,1112.3265358581073,0.06533152880414621,"",12.275
development/Goats.wav,/root/clawd/_datasets/clotho_3490684/audio_development/development/Goats.wav,A cawing and crying out of small birds chirping and farm animals.,A cawing and crying out of small birds chirping and farm animals.,"Birds screeching and squeaking, horn blaring in the background and then goat bleating","Birds squawking and cawing, with a horn beeping and a goat bleating.",Various birds and goats are chirping and baaing at each other.,Various birds and goats chirp and bleat at each other,development,Goats.wav,44100,22.253560090702948,19.94,1.7845359293163723,2.2566388030035354,,11.801566546650939,12326.197918390359,856.4694684472217,0.05594779056087548,"",35.878
development/Goldfinch and traffic.wav,/root/clawd/_datasets/clotho_3490684/audio_development/development/Goldfinch and traffic.wav,"A vehicle moving outside, at the same time birds sounds making music","A vehicle moving outside, at the same time birds sounds making music","As cars are driving and birds are chirping, someone plays an instrument in the distance,","Out in nature, birds singing, and ambulance passing by","Many birds chirping, traffic sounds, and a police siren.","The vehicle was moving along outside, while birds were merrily chirping and making their music.",development,Goldfinch and traffic.wav,44100,23.509954648526076,31.5,1.3978301760873724,0.7023730459605094,,0.0,127.84496515009516,142.10959439794854,0.029507782432403838,"",47.669
development/Morgens 04.wav,/root/clawd/_datasets/clotho_3490684/audio_development/development/Morgens 04.wav,A chicken crowing and birds chirping at the back,A chicken crowing and birds chirping at the back,"A mix of a rooster crowing and birds singing, chirping and tweeting.","A mix of rooster crowing, birds singing, chirping and tweeting.","Outside, a rooster crows twice as other birds chirp merrily away.",a rooster crows twice with birds chirping outdoors,development,Morgens 04.wav,44100,24.219297052154197,10.847,2.1438415935904285,0.10998420142549864,,11.496342245172912,26835.510792677745,1747.274474375325,0.008085042313826177,"",31.82
development/LaCambre.wav,/root/clawd/_datasets/clotho_3490684/audio_development/development/LaCambre.wav,A variety of different birds are chirping and tweeting.,A variety of different birds are chirping and tweeting.,Birds are communicating while the wind blows in the background.,Birds sing and traffic makes noise far in the background.,Several different types of birds chirping and tweeting,The background was filled with blowing wind as the birds communicated through singing.,development,LaCambre.wav,44100,18.854580498866213,38.64,1.6913506181191693,0.22187398145202725,,9.123691159564302,6552.840590864121,773.3328102798916,0.06847850021731082,"",29.561
development/Growing Hum.wav,/root/clawd/_datasets/clotho_3490684/audio_development/development/Growing Hum.wav,A bit of silence then a burst of random noise is preceded by six snips of scissors cutting hair,A bit of silence then a burst of random noise is preceded by six snips of scissors cutting hair,"A person repeatedly opens and closes a pair of scissors, then a warped mechanical whir resonates loudly.",A silence and then a loud strange musical instrument noise follow the cutting of hair with hair cutting scissors.,"Hair cutting scissors are cutting hair, which is followed by silence and then a loud strange musical instrument noise.","Six snips of some hair cutting scissors leads to silence, then a blow of random noise.",development,Growing Hum.wav,44100,20.526439909297054,39.43,1.1679377878480057,4.308782771093319,,0.0,66953848.73081404,1213885.878064272,0.08221678066282721,"",16.868
development/Hammer and nail.wav,/root/clawd/_datasets/clotho_3490684/audio_development/development/Hammer and nail.wav,"A hammer is striking a hard object, creating loud bangs.","A hammer is striking a hard object, creating loud bangs.",A person hammering a nail into wooden board indoors.,A person hitting a hollow bucket with a stick taking momentary pauses.,A person is hitting a hollow bucket with a stick and taking momentary pauses.,Someone is using a wooden object to strike another object.,development,Hammer and nail.wav,44100,27.869092970521542,22.47,1.6539634302874295,4.610934876793446,,11.981630946276617,437107.94083469594,5365.462918454136,0.059056643015473906,"",26.715
development/Hand coffee mill.wav,/root/clawd/_datasets/clotho_3490684/audio_development/development/Hand coffee mill.wav,A hard food is getting crunched constantly and loudly.,A hard food is getting crunched constantly and loudly.,"A heavy piece of metal grinds more than once, but stops in the middle before continuing.","A metal object grinds repeatedly, abruptly stopping every so often then resuming over time.",A person operating a grinder taking momentary pauses.,Momentary pauses are taken while a person operates a grinder,development,Hand coffee mill.wav,44100,25.10092970521542,34.46,1.961600541011858,1.6391865608799079,,0.0,579.1382447384487,229.8372896697444,0.04042337119747047,"",55.956
"development/WASHING,machine.wav","/root/clawd/_datasets/clotho_3490684/audio_development/development/WASHING,machine.wav",A air conditioner is blowing on its high setting,A air conditioner is blowing on its high setting,A person operating a pressing machine running inside a warehouse,A printing machine stamps as it prints out papers.,a printing machines is stamping and printing out papers,an electric humming as machinery clatters against itself,development,"WASHING,machine.wav",44100,25.56047619047619,24.68,1.184300995254816,1.600850361765317,,0.0,13589.513780752552,949.6859497782077,0.04753189330001573,"",47.737
development/md10trk1.wav,/root/clawd/_datasets/clotho_3490684/audio_development/development/md10trk1.wav,"A rush of water is pouring into a puddle, caused by a rainy night.","A rush of water is pouring into a puddle, caused by a rainy night.",It is raining and water is dripping down the corner of the house.,Rain is pouring off of a roof onto the ground.,"The water level is rising in the already half full container, as water continues to pour into it.",Water drips down the corner of a house as it rains,development,md10trk1.wav,44100,15.542902494331067,18.72,2.188420153714757,1.6827390281966168,,0.0,578.8041901478174,286.15549602749894,0.00916822731834715,"",34.607
development/Rain Thunder &amp; Water (Stereo).wav,/root/clawd/_datasets/clotho_3490684/audio_development/development/Rain Thunder &amp; Water (Stereo).wav,A moderate rain storm with rolling thunder rumbling.,A moderate rain storm with rolling thunder rumbling.,It is raining and water is draining off the corner of the house and it thunders.,"Lightening, thunder, and rain are filling the sky.","Lightning, thunder, and rain fill the stormy sky.",The rain was falling heavily as a loud clap of thunder followed by a smaller clap of thunder came.,development,Rain Thunder &amp; Water (Stereo).wav,44100,29.071383219954647,10.576,2.498616244556211,5.127642402604354,,0.0,5752.483685023014,1248.3678418770035,0.02472395920575978,"",61.116
development/Walking_hard_floor_with_squeeks_1-2.wav,/root/clawd/_datasets/clotho_3490684/audio_development/development/Walking_hard_floor_with_squeeks_1-2.wav,A person is stomping on wooden stairs as she climbs.,A person is stomping on wooden stairs as she climbs.,Someone is walking on a badly creaking hardwood surface.,"Someone is walking on a hardwood floor, perhaps up and down stairs, which are creaking a lot.",The stairs are making creaking noises in the background as I walk up them.,walking up stairs and creaking noises of the stairs in the background,development,Walking_hard_floor_with_squeeks_1-2.wav,44100,21.287936507936507,15.504,1.1173291969970272,4.212400506849289,,0.0,60270.99109470626,2205.4731381714673,0.06064179023744994,"",26.604
development/sfx-cutlery-1.wav,/root/clawd/_datasets/clotho_3490684/audio_development/development/sfx-cutlery-1.wav,"A person is filling the kitchen utensil drawer, then closes the drawer.","A person is filling the kitchen utensil drawer, then closes the drawer.",Metal objects in a container rub against each other and make a clanking sound.,Metal objects rub and clank against each other in a container.,She carefully organized the kitchen utensil drawer and then closed it.,"Someone is rattling cutlery around by moving, placing and dumping cutlery in various places.",development,sfx-cutlery-1.wav,44100,23.475374149659864,27.18,2.8066055553677147,3.593530853439721,,0.0,9797.381075072175,678.4309254960572,0.12250255528146953,"",40.449
development/steps on dead leaves pas sur feuilles mortes.wav,/root/clawd/_datasets/clotho_3490684/audio_development/development/steps on dead leaves pas sur feuilles mortes.wav,A person is walking around in the leaves on their break.,A person is walking around in the leaves on their break.,A person is walking through a patch of dry leaves.,A person is walking through grass and leaves.,A person is walking through some grass and leaves.,Someone is walking through a patch of dry leaves.,development,steps on dead leaves pas sur feuilles mortes.wav,44100,23.67936507936508,12.648,2.753847810947471,5.050743848209417,,0.0,125048.40760124287,2891.9624559861395,0.012160029750596846,"",50.382
development/House_gas stove_lighting.wav,/root/clawd/_datasets/clotho_3490684/audio_development/development/House_gas stove_lighting.wav,A metal object strikes another metal object and a gas burner is ignited.,A metal object strikes another metal object and a gas burner is ignited.,"Someone turns a stove on, increases the flame then shuts it off.",The loud noise made a crackle with other sounds.,The whir of a gas stove burning and then flicking off.,"someone lighting up a gas pilot burner, turning it up, then turning it off",development,House_gas stove_lighting.wav,44100,17.287256235827666,17.47,1.9730177872724033,2.0014682590848114,,0.0,33925.51051739381,2682.4337729906733,0.030737056705430584,"",33.116
development/Hyeres street voices ambience f.wav,/root/clawd/_datasets/clotho_3490684/audio_development/development/Hyeres street voices ambience f.wav,A person is walking in the beginning and men are talking in the background throughout,A person is walking in the beginning and men are talking in the background throughout,A person is walking in the beginning while men are talking in the background throughout.,A waitress walks by people who are chatting in an open air restaurant.,People are chatting in an open air restaurant as a waitress walks by.,The men are carrying on a conversation as the video goes on.,development,Hyeres street voices ambience f.wav,44100,18.584716553287983,17.62,1.0748901028569802,2.2809293073792447,,0.0,1999.280009301471,640.4441470420832,0.03914358139636998,"",23.496
development/restaurant sounds.wav,/root/clawd/_datasets/clotho_3490684/audio_development/development/restaurant sounds.wav,"In a restaurant, people are eating and talking.","In a restaurant, people are eating and talking.",People are gathering and talking at the restaurant and a waitress carries plates and utensils.,People are talking and eating in a restaurant.,"People gathering and talking, restaurant or meal, a person carrying food, plates utensils.","While people are talking, silverware is being moved around on a hard object.",development,restaurant sounds.wav,44100,26.75798185941043,28.25,1.570719025859199,1.0155951637651675,,0.0,5262.378068265844,678.5143571833883,0.04323012758392558,"",52.432
development/IKEA_Cafeteria.wav,/root/clawd/_datasets/clotho_3490684/audio_development/development/IKEA_Cafeteria.wav,A large group of people are around and everyone is talking.,A large group of people are around and everyone is talking.,A large group of people is around and everyone is talking.,Customers talk and utensils rattle in a restaurant or bar setting.,People are chattering in a bar and clinking glasses.,Restaurant or bar setting people talking while customers or utensils make some noise.,development,IKEA_Cafeteria.wav,44100,26.30172335600907,38.08,1.4056489024432663,0.18139175267627541,,0.0,2081.9319681033826,293.1571165345645,0.0369841579674914,"",54.589
development/Index Card Flips (handle business paper mvmt) 02.wav,/root/clawd/_datasets/clotho_3490684/audio_development/development/Index Card Flips (handle business paper mvmt) 02.wav,A person is shuffling playing cards out of a deck and laying them down on the table.,A person is shuffling playing cards out of a deck and laying them down on the table.,Folded papers are flipped in a steady rhythm.,Someone flips through the pages of a book methodically and slowly,"Someone flips, methodically and slowly, through the pages of a book.",Someone is flipping playing cards out of a deck and laying them down on the table.,development,Index Card Flips (handle business paper mvmt) 02.wav,44100,24.14875283446712,9.133,2.1222274745753094,4.673572939102586,,0.0,488465.43635910115,11952.011697898526,0.011746537578265409,"",20.642
development/Machete vs frying pan 2.wav,/root/clawd/_datasets/clotho_3490684/audio_development/development/Machete vs frying pan 2.wav,A metal implement or coin is repeatedly striking a metal tin.,A metal implement or coin is repeatedly striking a metal tin.,A metal object continuously hits a tin can,A metal surface gets hit methodically with a hammer.,A tin can is being hit over and over with a metal object.,metallic implement or coin repeatedly striking a metal tin.,development,Machete vs frying pan 2.wav,44100,17.109886621315194,16.04,2.2077326241009074,3.277934028371424,,10.94043290237029,12262065.82754124,115311.65277757494,0.03770424989703293,"",8.969
"development/Thunder in the distance, rain in proximity on 8th July 2012 in Berlin.wav","/root/clawd/_datasets/clotho_3490684/audio_development/development/Thunder in the distance, rain in proximity on 8th July 2012 in Berlin.wav",A thunderclap booms in the foreground while rain shower is in the background.,A thunderclap booms in the foreground while rain shower is in the background.,The rain increased outside following the roar of thunder.,Thunder is roaring followed by increasing rain outside,Thunderous clouds are rumbling with light rainfall in the background.,a thunderclap in the foreground with rain shower in the background,development,"Thunder in the distance, rain in proximity on 8th July 2012 in Berlin.wav",44100,23.68575963718821,14.179,0.8637030817182011,1.8203550879844737,,0.0,29394.497932757706,2153.2841320959815,0.03419878888651679,"",29.636
development/intense.wav,/root/clawd/_datasets/clotho_3490684/audio_development/development/intense.wav,A person changes the dial on a radio to change the station.,A person changes the dial on a radio to change the station.,"A radio is tuned, changing from station to station.","Radio stations are changed, accompanied by screeching static.",The radio has a trouble as the man tries to speak through it.,a radio being tuned in and out from station to station,development,intense.wav,44100,23.27027210884354,38.5,1.7270267653007718,0.5712729765434698,,0.0,110948.69441344007,3447.7459527073543,0.0675640600408176,"",48.894
development/washingmachine4.wav,/root/clawd/_datasets/clotho_3490684/audio_development/development/washingmachine4.wav,The engine of a truck is running loudly then quiets down.,The engine of a truck is running loudly then quiets down.,A vehicle engine starts running roughly at first and then it gets softer.,A vehicle with an engine that starts off with some trouble then it becomes smooth,The trucks engine is revving up loudly then idling down.,a motor starts up rough and warms up smooth out .,development,washingmachine4.wav,44100,24.5318820861678,25.8,1.3918681927829268,0.2953550844618697,,0.0,428.5044232412732,274.8177319278986,0.029449830868909645,"",48.289
development/loadingupdishwater.wav,/root/clawd/_datasets/clotho_3490684/audio_development/development/loadingupdishwater.wav,Dishes are being loudly moved around while being rinsed in the water.,Dishes are being loudly moved around while being rinsed in the water.,Dishes are being washed and then put down.,Someone is emptying the dishwasher and putting dishes away.,Someone is picking up dirty dishes from the table and placing them in the sink.,Someone picking up dirty dishes from the table and placing them in the sink.,development,loadingupdishwater.wav,44100,18.169614512471654,19.58,2.369314567124845,2.4137520112289685,,0.0,72474.52672849147,2342.3480198724374,0.03585183806820052,"",27.88
development/rainurban.wav,/root/clawd/_datasets/clotho_3490684/audio_development/development/rainurban.wav,A rainstorm with wind and traffic moving in the distance.,A rainstorm with wind and traffic moving in the distance.,A rainstorm with wind has traffic moving in the distance.,An bunch of running water going through an dirty stream.,Rain is pouring down strong in the storm.,Very heavy rain is falling while a faint traffic noise goes on in the distance.,development,rainurban.wav,44100,23.02,37.94,1.190081475280691,0.2535333103886501,,0.0,660.8787732300154,213.6679120895181,0.02341262410477055,"",44.681
