id,audio_path,text,caption_1,caption_2,caption_3,caption_4,caption_5,split,file_name,sample_rate,duration_s,loudness,sharpness,roughness,fluctuation_strength_proxy,pr_ecma_st,fluctuation_evr,fluctuation_ami,fluctuation_rms_mod,error,compute_time_s
development/Remix of 114382__jmorrisoncafe330__sax_man_Charlie_Rouse_own_voice_.wav,/root/clawd/_datasets/clotho_3490684/audio_development/development/Remix of 114382__jmorrisoncafe330__sax_man_Charlie_Rouse_own_voice_.wav,"A man is speaking, he pauses, then continues to speak.","A man is speaking, he pauses, then continues to speak.",A man speaks and what he says repeats itself for a second time.,"A man talks, and then says the same thing again.",A man is speaking and taking pauses between words.,Man is speaking and taking pauses between words.,development,Remix of 114382__jmorrisoncafe330__sax_man_Charlie_Rouse_own_voice_.wav,44100,17.20233560090703,29.64,1.5396247469869684,0.7824554671616102,,0.0,10274.110549649133,537.2210344972381,0.09657310496885392,"",15.725
development/ambiance metro.wav,/root/clawd/_datasets/clotho_3490684/audio_development/development/ambiance metro.wav,A large railway car is pulling into a station.,A large railway car is pulling into a station.,A large train car is pulling into a station.,A train hits the breaks and squeaks as it slows.,A train uses its breaks and the train squeaks as it slows.,a few objects moving in a mechanical room near a subway train.,development,ambiance metro.wav,44100,21.898480725623582,37.09,1.655192817091333,0.35475887666983197,,0.0,1058.9637629748424,306.0873770370529,0.04029475699118266,"",44.826
development/Durango-Silverton RR Dec 01 I 24 bit.wav,/root/clawd/_datasets/clotho_3490684/audio_development/development/Durango-Silverton RR Dec 01 I 24 bit.wav,A railroad crossing alarm is sounding while a locomotive approaches and then passes by.,A railroad crossing alarm is sounding while a locomotive approaches and then passes by.,A railway alarm is audible as the train approaches and then passes a point.,A steam engine begins chugging away as its whistle blows and its bell sounds.,An approaching train blowing its whistle while it chugs on the tracks.,"An approaching train blows its whistle, while it chugs closer on the tracks.",development,Durango-Silverton RR Dec 01 I 24 bit.wav,44100,27.236371882086168,35.58,1.4884533162939262,0.3133486378031431,,0.0,17283601.73469291,49219.544727620894,0.0610148809799212,"",53.381
development/BodySC.wav,/root/clawd/_datasets/clotho_3490684/audio_development/development/BodySC.wav,A person is walking along a gravel path.,A person is walking along a gravel path.,"On a windy day, the man walks through snow and ice.",Someone walks through snow and ice on a windy day.,Wind distortion in the foreground with the crunching of footsteps and a humming vehicle at the end.,Wind sound with the crunching of footsteps and a vehicle hums by.,development,BodySC.wav,44100,22.41451247165533,9.741,1.5582411900318018,5.925706366535663,,0.0,393827.19284938986,7804.7600633618395,0.0579774009053795,"",24.446
development/Commercial Oven Door Mechanism and Open Close.wav,/root/clawd/_datasets/clotho_3490684/audio_development/development/Commercial Oven Door Mechanism and Open Close.wav,A door is being opened and closed over and over.,A door is being opened and closed over and over.,A door is being opened and closed repeatedly.,A door latch being pulled and a door opening and shutting in a repeated fashion.,A door latch is being pulled and a door is opening and shutting in a repeated fashion.,A gun shot occurs while a person loads it several times.,development,Commercial Oven Door Mechanism and Open Close.wav,44100,23.117256235827664,9.964,1.8362844523315516,2.6500358163608015,,0.0,563657.4640144514,13954.688694462575,0.022222741595745752,"",15.857
development/january birds yorkshire.wav,/root/clawd/_datasets/clotho_3490684/audio_development/development/january birds yorkshire.wav,A gentle wind blowing behind several birds chirping.,A gentle wind blowing behind several birds chirping.,Birds chirping with a gentle wind in the background.,Small birds singing in the distance were almost inaudible.,"The gentle sound of birds chirping, calling, and singing in the background.","faint sound of birds chirping in the distance,",development,january birds yorkshire.wav,44100,24.79716553287982,1.213,3.688937313730891,0.03807084501078712,,0.0,7873.832380060805,35105.11419235898,0.0008880161609995443,"",10.415
development/kitchen.wav,/root/clawd/_datasets/clotho_3490684/audio_development/development/kitchen.wav,A ball being dropped on a table then rolled.,A ball being dropped on a table then rolled.,A ball drops on a table then rolls.,Amid the silence an item is being moved.,An item is being moved among otherwise silence.,"a low humming constantly, a hard object hits the floor and is moved back and forth across a wood floor.",development,kitchen.wav,44100,18.274104308390022,11.517,1.0004893106804034,0.5129017205269943,,0.0,161052.03905256305,5496.36676395866,0.02787699147840819,"",20.689
development/scrapping.wav,/root/clawd/_datasets/clotho_3490684/audio_development/development/scrapping.wav,A knife being sharpened on a metal grinder.,A knife being sharpened on a metal grinder.,A knife is being sharpened on a metal grinder.,"A large blade grinds and resonates back and forth against rough, sharpening tool.",Someone rubbing a piece of metal against another piece of metal,The steady rhythm of steel grinding against steel.,development,scrapping.wav,44100,21.0140589569161,19.38,2.739401986860371,1.0874306320967997,,0.0,1522.8989206167216,284.0076052658017,0.03694627778597894,"",37.528
development/Floor_trading3.wav,/root/clawd/_datasets/clotho_3490684/audio_development/development/Floor_trading3.wav,A bell rings and a several people are talking in a crowd.,A bell rings and a several people are talking in a crowd.,A bell sounds while crowds of people chatter and cheer.,"A large group of people are talking, some yelling, and a bell rings once.","Crowds chatter, a bell sounds and people continue to chatter and cheer.","When the bell rings, several people are still talking.",development,Floor_trading3.wav,44100,18.210090702947845,30.26,1.1887717177285377,1.2513524583039595,,0.0,9458.87002572819,649.930598804558,0.06828935405275297,"",29.688
development/Pelicans_Baby Pelicans_Waves.wav,/root/clawd/_datasets/clotho_3490684/audio_development/development/Pelicans_Baby Pelicans_Waves.wav,Many seagulls are squawking and chirping over the ocean.,Many seagulls are squawking and chirping over the ocean.,Seagulls are cawing and chirping as wave crash on the shore.,"Seagulls are squawking, chirping and cawing as waves are gently lapping the ocean shore.","Seagulls are squawking, chirping, and cawing as waves gently lap the ocean shore.",The seagulls are cawing and chirping while the waves is crashing the shore,development,Pelicans_Baby Pelicans_Waves.wav,44100,27.0553514739229,36.36,1.5420102310945043,0.1696895979958736,,0.0,10526.719874119466,818.7200923090099,0.052091979996838386,"",52.869
development/Gentle Sea On Flat Beach.wav,/root/clawd/_datasets/clotho_3490684/audio_development/development/Gentle Sea On Flat Beach.wav,A person rolls for a while in a pond.,A person rolls for a while in a pond.,"The water ran, splashing as it dropped into the pool.",Water in a river is lapping up against a dock.,Water in the river is lapping up against a dock.,"Water splashing, running, and dropping into and a pool.",development,Gentle Sea On Flat Beach.wav,44100,25.78954648526077,19.17,1.8300692451587504,1.7849622148566897,,0.0,3277.389441641303,798.3673795180629,0.012382619932007023,"",48.647
development/sail-boat-inside.wav,/root/clawd/_datasets/clotho_3490684/audio_development/development/sail-boat-inside.wav,A boat in the water is moving closer and closer,A boat in the water is moving closer and closer,"In the water, a boat is moving increasingly nearer.",Water is lapping up against a boat and a dock.,Water is lapping up against the dock and boat.,Water rubs against the side of a container and echoes.,development,sail-boat-inside.wav,44100,22.117324263038547,14.904,1.2004013917482839,1.421765096234602,,0.0,4059894.577700791,34150.218526757286,0.04348590659690108,"",32.2
development/two noise generators 01.wav,/root/clawd/_datasets/clotho_3490684/audio_development/development/two noise generators 01.wav,A radio is playing but producing only loud electrical static.,A radio is playing but producing only loud electrical static.,Loud electrical static noise plays on a radio.,The sound grew higher in pitch with a clear buzzing and clicking.,static electricity from some type of electronic device caused distinct static noises in the back,static from some type of electronic device with distinct static noises in the back,development,two noise generators 01.wav,44100,26.706666666666667,28.42,2.0504205870698518,2.7205029485337975,,0.0,38055.004843730785,1166.1479558571589,0.05765264858819812,"",57.31
development/Bird Effects ME.A1.wav,/root/clawd/_datasets/clotho_3490684/audio_development/development/Bird Effects ME.A1.wav,A large amount of rain is falling down outside.,A large amount of rain is falling down outside.,A very strong waterfall is flowing at a brisk and steady rate.,An very strong waterfall is flowing at a brisk and steady rate.,Rain falls down at a constant and heavy rate.,Rain falls down heavily at a constant rate.,development,Bird Effects ME.A1.wav,44100,23.364920634920637,38.08,2.5945383475269024,0.08015944439626822,,0.0,100.95795896793885,142.24432956614174,0.01062193221070556,"",55.369
development/ship engine.wav,/root/clawd/_datasets/clotho_3490684/audio_development/development/ship engine.wav,A motor gurgles and churns heavily and steadily.,A motor gurgles and churns heavily and steadily.,A truck is idle and covers all the other noises.,An idling truck seems to cover all the other noises.,An large engine chugs and gurgles steadily and continuously.,An old engine is idling and not running very fast.,development,ship engine.wav,44100,26.714739229024943,17.44,1.0494306675157026,0.5651043940730407,,0.0,11859.833031083495,751.9009413350565,0.02264030110738054,"",35.998
development/BitmapNoise1.wav,/root/clawd/_datasets/clotho_3490684/audio_development/development/BitmapNoise1.wav,A shrill electronic buzz repeats in a pattern.,A shrill electronic buzz repeats in a pattern.,A shrill electronic buzz repeats itself in a pattern.,An electric static noise ringing and playing in a series of pitches.,Annoying static that continuously changes volumes and tone.,Annoying static that continuously changes volumes and tones.,development,BitmapNoise1.wav,44100,17.83902494331066,30.75,2.4294576836053916,5.896684505550827,,0.0,60.82964850593368,100.20847808691008,0.043833739696489696,"",35.228
"development/INT Factory budimka, pozega.wav","/root/clawd/_datasets/clotho_3490684/audio_development/development/INT Factory budimka, pozega.wav",A heavy engine automobile operating and pressing off steam.,A heavy engine automobile operating and pressing off steam.,A large vehicle running and the hiss of steam.,Cars are getting washed in the shop by a water spraying machine.,Low mechanical rumbling with an occasional annoying hiss in the background.,Low mechanical rumbling with occasional hissing in the background.,development,"INT Factory budimka, pozega.wav",44100,18.139433106575964,29.98,1.5542855720070112,0.09937340498019194,,0.0,1795.546698370151,427.8406055286646,0.03094478099092736,"",34.706
development/book_heavy_noise.wav,/root/clawd/_datasets/clotho_3490684/audio_development/development/book_heavy_noise.wav,A person flips through the pages of a book very fast.,A person flips through the pages of a book very fast.,A person going through pages of a book very rapidly.,A person is flipping through pages of a book very fast.,A person is going through pages of a book rapidly.,flipping pages of a book and scribbling down on paper with a marker.,development,book_heavy_noise.wav,44100,27.190566893424037,20.0,1.6677916581220464,4.633273770684765,,0.0,131511.400163852,2945.0495463281577,0.03868185217299783,"",41.971
development/Dripping water on metal.wav,/root/clawd/_datasets/clotho_3490684/audio_development/development/Dripping water on metal.wav,A tap pouring water into a metal sink and then eventually being turned off.,A tap pouring water into a metal sink and then eventually being turned off.,Rain patters steadily on a tin roof and water slides off,Rain patters steadily on a tin roof while the water slides off.,Water dropping roughly onto a thin metal but no heavy rainfall.,Water is pouring into a metal sink from the tap and is eventually turned off.,development,Dripping water on metal.wav,44100,19.574421768707484,19.47,1.632624375307841,0.20645993678725869,,0.0,62106.51856914854,1711.4540192487857,0.021945496012663393,"",35.409
development/RBH_Household_Bathroom fan.wav,/root/clawd/_datasets/clotho_3490684/audio_development/development/RBH_Household_Bathroom fan.wav,"A machine begins to run, then turns off.","A machine begins to run, then turns off.",A person operating an electric power tool in a garage.,A person roughly operates an electric power tool while working in a garage.,The motor of a generator runs steadily in a factory,Wind is blowing while a vehicle is in motion.,development,RBH_Household_Bathroom fan.wav,44100,19.56281179138322,40.85,1.4146933527243688,0.3242559579519816,,0.0,4658.624425706626,749.5397755340767,0.04073080045910949,"",40.282
development/SmallJarLidScrewUnscrew.wav,/root/clawd/_datasets/clotho_3490684/audio_development/development/SmallJarLidScrewUnscrew.wav,Glasses are stacked as a glass is pulled across the table.,Glasses are stacked as a glass is pulled across the table.,"Object, open and closing of the lid of the object multiple times.",The opening and closing of the lid of an object multiple times.,Two hard objects are being rubbed together over and over again.,"sliding a glass jar on a counter top, and taking the cap on and off as it slides.",development,SmallJarLidScrewUnscrew.wav,44100,29.61705215419501,10.025,2.1383092483430906,4.574466952095892,,0.0,42283.895570664674,3253.764944569369,0.010608849683111,"",30.804
development/munition_shells.wav,/root/clawd/_datasets/clotho_3490684/audio_development/development/munition_shells.wav,A coin is dropped into a glass bottle eight times.,A coin is dropped into a glass bottle eight times.,A light metal object is repeatedly dropped onto a hard surface.,"A light, metal object is being picked up and repeatedly dropped onto a hard surface.",A person flipping coins onto a hard surface.,A person is flipping coins onto a hard surface.,development,munition_shells.wav,44100,19.016326530612243,7.217,5.156407491562952,1.3817054371505149,,13.84416399458376,2907.67546436694,574.9520826734554,0.0491418029767448,"",16.667
development/Demolition_Backhoe_Debris into Dumpster #3.wav,/root/clawd/_datasets/clotho_3490684/audio_development/development/Demolition_Backhoe_Debris into Dumpster #3.wav,A machine is running in the background and hard objects are being scraped and moved over another hard surface.,A machine is running in the background and hard objects are being scraped and moved over another hard surface.,An engine whirs while objects break and snap into pieces.,An loaded trash truck crunching the trash to make more room inside the back.,Someone is knocking into something heavy sounding it seems.,The engine rumbles as things begin to break and snap off.,development,Demolition_Backhoe_Debris into Dumpster #3.wav,44100,23.090226757369614,29.09,1.5708810629259893,0.47995130749408504,,0.0,6173.65528789556,1172.7553802061334,0.03862734477740902,"",44.395
development/carpet_on_carpet.wav,/root/clawd/_datasets/clotho_3490684/audio_development/development/carpet_on_carpet.wav,A person banging shoes together then sweeping a floor.,A person banging shoes together then sweeping a floor.,"A person sweeps a hard surface, takes several steps in heels, and sweeps again.","A person sweeps a hard surface, while walking in heels.",A woman walking in heels on a wooden floor is sweeping and then walks off.,First a person bangs shoes together and then sweeps the floor.,development,carpet_on_carpet.wav,44100,23.179410430839003,7.854,1.4726504346817029,4.146797899442342,,0.0,983276.9231486955,50653.138716754045,0.010498646260658212,"",16.643
development/by a busy road background.wav,/root/clawd/_datasets/clotho_3490684/audio_development/development/by a busy road background.wav,"Cars are pass by on a nearby road, as something is being crinkled.","Cars are pass by on a nearby road, as something is being crinkled.",A large amount of cars is quickly driving by.,Road noise of cars passing by then a crinkling sound at the very end.,"The cars pass by, driving at an even rate of speed.",traffic noises with a loud car in the middle and crunching noises near the end,development,by a busy road background.wav,44100,26.761315192743766,21.0,1.0686117387549179,0.945897178528384,,0.0,248147.6273664734,4808.240250015702,0.043073677820381226,"",40.85
development/Paper_Shuffling_Crinkling_Crisp.wav,/root/clawd/_datasets/clotho_3490684/audio_development/development/Paper_Shuffling_Crinkling_Crisp.wav,A person flips the pages of a book.,A person flips the pages of a book.,A person is flipping pages of a book.,Multiple pages of paper are being turned over.,Multiple pieces of paper are being turned over.,paper being crinkled over and over in the foreground,development,Paper_Shuffling_Crinkling_Crisp.wav,44100,23.08063492063492,8.397,2.6943868067474956,4.025066726796485,,0.0,65151.75985261917,4872.971603056018,0.006573614579820671,"",24.809
development/school break noise outdoor.wav,/root/clawd/_datasets/clotho_3490684/audio_development/development/school break noise outdoor.wav,A group of people including children are playing and shouting.,A group of people including children are playing and shouting.,Some kids make noises as they place outside.,The adults and children are talking loudly and excitedly in the large waiting area.,The large waiting area has adults and children talking loudly in it.,a group of people including kids are shouting and playing.,development,school break noise outdoor.wav,44100,23.319160997732425,24.6,1.3611147835021589,0.16883688974531005,,0.0,7244.094542993079,658.088005864696,0.07813315386049044,"",39.477
development/FloiseFlower test 2.wav,/root/clawd/_datasets/clotho_3490684/audio_development/development/FloiseFlower test 2.wav,A very strong wind is blowing outside the windows of a house.,A very strong wind is blowing outside the windows of a house.,A very strong wind is blowing past the windows of a house,"An engine runs continually, increasing and decreasing in intensity.",Cars are passing by on the freeway going fast along with the wind.,The wind is blowing strongly and continued at the same strength,development,FloiseFlower test 2.wav,44100,29.9,32.15,1.2068099692845144,0.13592321293314183,,0.0,148.96351799179914,173.57541485909024,0.04053741375947068,"",47.893
development/Stock wind sound.wav,/root/clawd/_datasets/clotho_3490684/audio_development/development/Stock wind sound.wav,A wind storm blows outside of a house.,A wind storm blows outside of a house.,Wind blowing outside during a storm from inside a house.,Wind passing around a building rises and falls in pitch as its strength rises and falls.,"Wind rolls around a building, creating a loud noise while rising and falling.",Winds blow at high speed creating a whistle,development,Stock wind sound.wav,44100,16.696757369614513,22.41,0.9778222883591612,1.9987423850527237,,0.0,31163.550740218827,1314.5267955751142,0.06803667373562693,"",18.973
development/Hill Top Ambaince.wav,/root/clawd/_datasets/clotho_3490684/audio_development/development/Hill Top Ambaince.wav,A man speaks after the wind blows around.,A man speaks after the wind blows around.,The wind is blowing and then a man speaks.,Waves and wind blowing followed by a man speaking,Waves and wind blowing sound followed by a man speaking,air static and a man saying words in the last five seconds.,development,Hill Top Ambaince.wav,44100,25.27004535147392,15.554,1.5819062095821421,1.262655490328516,,0.0,445685.16546468576,9427.792742609125,0.029056073952005358,"",28.972
development/La Barca i La Tempesta.wav,/root/clawd/_datasets/clotho_3490684/audio_development/development/La Barca i La Tempesta.wav,A screen door is opened and closed and popcorn pops.,A screen door is opened and closed and popcorn pops.,Loud screeching noises and constant knocking on an object with movement.,Popcorn is popping as a screen door opens and closes.,The birds were squeaking the background and popping noises were in the foreground.,birds squeaking in the background and popping noises in the foreground,development,La Barca i La Tempesta.wav,44100,21.932244897959183,19.44,2.183841639474398,0.6557769694487824,,0.0,7366.071975191864,528.9638001167914,0.020602722331820252,"",42.951
development/marche1.wav,/root/clawd/_datasets/clotho_3490684/audio_development/development/marche1.wav,A person walking along a dirt path outdoors while birds sing.,A person walking along a dirt path outdoors while birds sing.,Birds are singing and footsteps are moving steadily moving on the ground.,Birds are singing and footsteps are moving steadily on the ground.,Someone is walking along a dirt trail as birds chirp.,Someone is walking with birds whistling in the background.,development,marche1.wav,44100,21.305714285714284,16.18,2.38418639333286,3.7147926299768184,,0.0,29221.04016088234,2328.2864474891417,0.02066741328714792,"",40.782
development/banging.wav,/root/clawd/_datasets/clotho_3490684/audio_development/development/banging.wav,"A semi truck backs up, heavy banging starts, then the semi drives away.","A semi truck backs up, heavy banging starts, then the semi drives away.",A truck backing up to a warehouse where boxes are being stacked up.,A truck backs up to warehouse where boxes are being stacked up.,Machinery is running while hard objects are being dropped onto a hard surface.,Machinery running and hard objects being dropped onto a hard surface at the same time.,development,banging.wav,44100,22.783242630385487,17.65,1.1402474051725786,0.94525767616901,,0.0,18748.520862288948,1359.238933063363,0.038542105302702016,"",28.888
development/audience final applause 01.wav,/root/clawd/_datasets/clotho_3490684/audio_development/development/audience final applause 01.wav,An audience clapping loudly that slowly fades away in volume.,An audience clapping loudly that slowly fades away in volume.,"Hands are clapping, and people are continuously applauding and cheering.",The clapping and cheering crowd grew softer as time went on.,an audience clapping loudly that gets slower and quieter near the end,"hands are clapping, people are continuously applauding and cheering",development,audience final applause 01.wav,44100,19.67204081632653,23.89,1.6301068257043478,2.1980923971875717,,0.0,3372.166228839704,463.5787025940717,0.013432973843133031,"",36.621
development/fan_2_300513.wav,/root/clawd/_datasets/clotho_3490684/audio_development/development/fan_2_300513.wav,A person standing next to a freeway during rush hour.,A person standing next to a freeway during rush hour.,Ambient car noises in a city with rain falling.,"During rush hour, a person stands next to a busy freeway.",Everything else is covered by a steady roar of machinery.,Wind blowing outside from the inside of a room.,development,fan_2_300513.wav,44100,17.701315192743763,36.11,1.1918299829930232,0.1408127676347118,,0.0,226.81199223760615,126.09016998144743,0.023850842750227173,"",31.522
development/Garden.wav,/root/clawd/_datasets/clotho_3490684/audio_development/development/Garden.wav,"A boat horn goes off in the distance and some birds begin squawking, and more birds begin chirping.","A boat horn goes off in the distance and some birds begin squawking, and more birds begin chirping.",A single bird caws out angrily at a tree while others chirp happily.,A single bird caws out angrily while others chirp happily.,Birds screeching and chirping as cars are moving by underneath.,Some birds are squawking and then more birds are chirping as a boat horn goes off in the distance.,development,Garden.wav,44100,16.899410430839,24.06,1.9290527003157485,0.3430872564704384,,0.0,50611.247012949636,2222.344681748346,0.03347443184579456,"",25.262
development/paper_bag.wav,/root/clawd/_datasets/clotho_3490684/audio_development/development/paper_bag.wav,A crackling movement sound is occurring from something.,A crackling movement sound is occurring from something.,Moving around really nearby and whispering some breath.,Nearby moving around and a whispering of breathing.,Someone rubbing against something and walking at the same time.,The person is rubbing against something while walking.,development,paper_bag.wav,44100,23.449727891156463,26.66,1.686692779079273,5.205798595552859,,0.0,206552.78865883613,6057.231337754715,0.05877805751013677,"",37.972
development/02901 hurricane wind in suburb.wav,/root/clawd/_datasets/clotho_3490684/audio_development/development/02901 hurricane wind in suburb.wav,A siren wails into the open air while waves lap the shore,A siren wails into the open air while waves lap the shore,The booming alarm is in the foreground while busy traffic is in the background.,Water flows and splashes before a horn blows.,Water is running and splashing then a horn sounds.,"Waves are coming onto the shore, and a siren is blowing.",development,02901 hurricane wind in suburb.wav,44100,17.287777777777777,31.35,1.3727025866629106,0.17140091809058833,,12.897747572316284,2198.5140976537814,428.8701719590942,0.033520627193820145,"",31.074
