id,audio_path,text,caption_1,caption_2,caption_3,caption_4,caption_5,split,file_name,sample_rate,duration_s,loudness,sharpness,roughness,fluctuation_strength_proxy,pr_ecma_st,fluctuation_evr,fluctuation_ami,fluctuation_rms_mod,error,compute_time_s
development/drunks fighting.wav,/root/clawd/_datasets/clotho_3490684/audio_development/development/drunks fighting.wav,Breaking glass echoes as people are yelling in the street.,Breaking glass echoes as people are yelling in the street.,Men are yelling and murmuring just before someone breaks glass.,Open chatter and yelling in an open area with glass breaking at the end.,"People are chatting with some speaking loudly in the open outdoors and, then, a glass is broken.",People on the street are yelling and then glass breaks.,development,drunks fighting.wav,44100,17.79809523809524,28.2,1.4385464602937905,1.0157154509861503,,0.0,17682.644382958817,1260.4830194114868,0.06122109203121012,"",26.289
development/entralanovia.wav,/root/clawd/_datasets/clotho_3490684/audio_development/development/entralanovia.wav,A bell rings while voices sing and music plays in the background.,A bell rings while voices sing and music plays in the background.,A school bell rings while an organ plays a melody amid a crowd of adults and children quietly murmuring.,"Bells chiming, people conversing and other musical instruments playing in the background.",People are having a conversation with each other during the time a train is going by.,"People converse as bells chime and, in the background, other musical instruments play.",development,entralanovia.wav,44100,21.78031746031746,36.35,1.4706044338706399,0.14749543724240058,,0.0,1418.5220352356284,242.16804099442732,0.04731739872704389,"",38.556
development/Waves Against Shore .wav,/root/clawd/_datasets/clotho_3490684/audio_development/development/Waves Against Shore .wav,"A rocky shore on a beach stands up to large, crashing waves.","A rocky shore on a beach stands up to large, crashing waves.",Large waves crashing against a rocky shore on a beach.,Ocean waves roll in and break on the shore.,The waves of the ocean are rolling in and breaking on the shore.,Water splashes hard as wind blows and a bird chirps.,development,Waves Against Shore .wav,44100,17.348820861678004,31.05,1.4078465541291707,0.15961713320426665,,0.0,2888.568486281356,428.4388129613327,0.051994952581676926,"",34.344
development/BuisnessMen and SportsGuys_HartfordCT_March2012 .wav,/root/clawd/_datasets/clotho_3490684/audio_development/development/BuisnessMen and SportsGuys_HartfordCT_March2012 .wav,A crowd of people are talking and shouting over each other.,A crowd of people are talking and shouting over each other.,A group of people talking and shouting among each other.,"A man is talking, while in the background, a loud television or movie is playing.",The crowd is very noisy during that time the announcer is trying to speak and they are getting louder.,a man talking with a loud television or movie playing in the background.,development,BuisnessMen and SportsGuys_HartfordCT_March2012 .wav,44100,21.161360544217686,37.65,1.3833568794110753,0.22249686319967765,,0.0,4815.043326975295,431.3623764408539,0.06630515260707223,"",33.662
development/London_Underground_01.wav,/root/clawd/_datasets/clotho_3490684/audio_development/development/London_Underground_01.wav,A subway is passing through a tunnel as the announcer speaks on the intercom.,A subway is passing through a tunnel as the announcer speaks on the intercom.,A subway riding through a tunnel while an announcer speaks on an intercom.,A train is rumbling as it drives and a voice announces something.,The inside of a train and people chatter inside.,The rumbling train run down the rail as a voice says something. ,development,London_Underground_01.wav,44100,25.99562358276644,19.45,1.180641324133055,0.13003588048140827,,0.0,96636.84846482018,2773.4038906775754,0.08195038940875644,"",41.039
development/august_rain-007.wav,/root/clawd/_datasets/clotho_3490684/audio_development/development/august_rain-007.wav,A campfire is crackling and a storm is roaring in the distance.,A campfire is crackling and a storm is roaring in the distance.,"A campfire crackling, and a storm roaring in the distance.",It is raining and the wind is blowing.,The weather is getting bad as it is raining heavily and the wind is blowing very hard.,Thunder is rolling as rain is pouring down.,development,august_rain-007.wav,44100,19.583990929705216,8.511,1.2601535766094936,3.449411303562051,,0.0,3147328.344860838,29135.937201647535,0.025242491073097367,"",26.307
development/rain_traffic_thunder.wav,/root/clawd/_datasets/clotho_3490684/audio_development/development/rain_traffic_thunder.wav,A consistent rainfall is taking place in the foreground.,A consistent rainfall is taking place in the foreground.,A heavy rain coming down outside with thunder in the background.,Rain falling at a constant rate in the foreground.,Thunder was in the background as heavy rain came down outside.,"Weather, thunder, rain droplets near and rain further.",development,rain_traffic_thunder.wav,44100,16.90219954648526,24.11,1.7112097634728463,0.18488559831497578,,0.0,239.3796635875947,212.75409601934786,0.02481795375843706,"",35.978
development/Thunder &amp; Rain.wav,/root/clawd/_datasets/clotho_3490684/audio_development/development/Thunder &amp; Rain.wav,"In the weather, multiple thunder claps and rain drops as birds chirping.","In the weather, multiple thunder claps and rain drops as birds chirping.",Many birds are chirp softly while thunder begins to roar.,Many birds are chirping lightly while thunder begins to roar.,Thunder rolls through twice and birds are chirping softly.,"Weather, multiple thunder claps, rain drops, birds chirping.",development,Thunder &amp; Rain.wav,44100,27.48081632653061,11.312,0.7616224826875786,0.43583841211098423,,0.0,56599.34117723216,2976.3025715194253,0.03656066044360919,"",28.564
development/RG Window.wav,/root/clawd/_datasets/clotho_3490684/audio_development/development/RG Window.wav,A drawer is opened and closed a few times.,A drawer is opened and closed a few times.,A drawer is slid open and closed a few times.,"A sliding door is opened, then closed and opened again.",A sliding door moving open and then closing and opening again.,Drawer or roll top desk opening and closing.,development,RG Window.wav,44100,16.758934240362812,10.925,1.6600433020955263,2.350244675782766,,0.0,2143.354652793106,725.8470937201942,0.019374754308929352,"",11.697
development/dishwashing_1.wav,/root/clawd/_datasets/clotho_3490684/audio_development/development/dishwashing_1.wav,"A faucet is operated, and water splashes and objects are placed down.","A faucet is operated, and water splashes and objects are placed down.","A faucet is turned on, and the water is splashed around and objects are set down.",A faucet runs while dishes and utensils are placed.,Someone is running water and washing or rinsing dishes.,Water is running while a person is washing or rinsing dishes.,development,dishwashing_1.wav,44100,19.22612244897959,19.42,2.297942449249193,0.8764049528670166,,0.0,228246.55681363642,6067.367468382239,0.03377401245419907,"",35.212
development/Kyle of Lochalsh harbour.wav,/root/clawd/_datasets/clotho_3490684/audio_development/development/Kyle of Lochalsh harbour.wav,Someone is washing and rinsing dishes in a sink.,Someone is washing and rinsing dishes in a sink.,Someone washing themselves in a tub filled with water,The buzz of an engine was followed by water sloshing in the background.,"The water is being splashed around, over an electric humming.",someone washing themselves in a bathtub filled with water,development,Kyle of Lochalsh harbour.wav,44100,24.151836734693877,22.49,1.459016757200932,1.0380001998122261,,0.0,49811.12037784032,1649.3900681222253,0.08702163494695633,"",39.309
development/Skwer Starszych Panow Piatek Popoudniu.wav,/root/clawd/_datasets/clotho_3490684/audio_development/development/Skwer Starszych Panow Piatek Popoudniu.wav,A car engine that is on with a man talking at one point.,A car engine that is on with a man talking at one point.,A dog barks while birds chirp and a car drives and people talk.,"A dog barks, birds chirp, a car drives and people talk in the background.",Adults and children talking while dogs bark in the distance,Constant background noise with a dog barking and people talking but barely audible.,development,Skwer Starszych Panow Piatek Popoudniu.wav,44100,24.665056689342403,7.072,1.5485188017073983,4.526007892321265,,0.0,9506.038293080579,1364.1895393726782,0.05062325624807485,"",23.587
development/crow.wav,/root/clawd/_datasets/clotho_3490684/audio_development/development/crow.wav,A bird cackling in the foreground with other birds chirping in the background.,A bird cackling in the foreground with other birds chirping in the background.,A crow cries loudly as other birds chirp during a stream of traffic in the background.,A large bird chirping outdoors with smaller birds chirping nearby.,One bird chirps loudly while other birds are chirping in the background.,Some little birds are singing at the same time that one bird is squawking.,development,crow.wav,44100,19.156462585034014,27.54,2.044104712359214,0.18323148881980636,,0.0,5795.763083284883,457.6679849592213,0.07736920766164393,"",30.331
"development/MEN RUNNING, FOREST, BREATHING (2).wav","/root/clawd/_datasets/clotho_3490684/audio_development/development/MEN RUNNING, FOREST, BREATHING (2).wav",A man runs by breathing heavily over the soft and brief speaking of a person in the background,A man runs by breathing heavily over the soft and brief speaking of a person in the background,A person is running and out of breath and then slows down.,A person speaks briefly and softly in the background as a man runs by them breathing heavily.,Someone is running through the grass and leaves and breathing hard,Someone running through grass and leaves while breathing heavily.,development,"MEN RUNNING, FOREST, BREATHING (2).wav",44100,17.2756462585034,13.909,1.8326014142908886,3.7808272325161916,,0.0,44789.613174350874,1967.0786241374224,0.01399194497064286,"",27.698
development/PassingDieselCar.wav,/root/clawd/_datasets/clotho_3490684/audio_development/development/PassingDieselCar.wav,A car drives by as birds chip in the background.,A car drives by as birds chip in the background.,As birds are chirping a car drives past.,Birds are chirping and a car drives past.,Birds chirp as the sound of a car engine gets louder and then softer.,birds chirping in the background while a car is driving by,development,PassingDieselCar.wav,44100,16.70956916099773,25.8,1.5285739529335456,0.10818552732691804,,0.0,65584.29217205202,2595.755718757834,0.012361513451488605,"",25.053
development/Boston Street Morning.wav,/root/clawd/_datasets/clotho_3490684/audio_development/development/Boston Street Morning.wav,A bus driving by and birds chirping in the distance,A bus driving by and birds chirping in the distance,"Air brakes occur as the vehicles drive by, as birds chirp in the distance.",Air is rushing as a large vehicle passes by and then air is let out.,Birds chirping in the background as a vehicle drives by.,"vehicles driving by, birds chirping, and air brakes used",development,Boston Street Morning.wav,44100,15.82421768707483,29.78,1.5353422475277028,0.10102979937960922,,0.0,789.8908794767107,299.9350136563814,0.029207992272013494,"",29.333
development/Construction work in progress.wav,/root/clawd/_datasets/clotho_3490684/audio_development/development/Construction work in progress.wav,Loud roaring and thumping comes from the construction equipment.,Loud roaring and thumping comes from the construction equipment.,People are working in the background and then a truck breaks and air is being let out,Someone pouring a object into another holding container.,The construction equipment was roaring and thumping loudly.,people working in the background and then a trucks air breaks being let out,development,Construction work in progress.wav,44100,24.271451247165533,19.24,1.4354974455215461,1.8646724382772244,,0.0,6872.669253809602,1631.428568505685,0.017938711965658473,"",37.997
development/wind-up.wav,/root/clawd/_datasets/clotho_3490684/audio_development/development/wind-up.wav,A device with a spring being wound up repeatedly and released.,A device with a spring being wound up repeatedly and released.,A toy is wound and let go on a table.,A wind up toy is being wound up and then let go on a table,A wind up engine is wound and released twice.,A wind up engine is wound up and released two times.,development,wind-up.wav,44100,26.881859410430838,19.36,3.918346368703499,3.0795569510385516,,21.75823604745873,1012.9990669256335,375.3109461772955,0.02991890261490019,"",56.357
development/kitchen metal.wav,/root/clawd/_datasets/clotho_3490684/audio_development/development/kitchen metal.wav,A person clangs metal objects together in a metal bin,A person clangs metal objects together in a metal bin,A person is clanging metal objects in a metal bin together.,Metal pots are being shuffled around and tapped on.,"People banging on pots, pans and wind chimes","Pots, pans, and wind chimes being banged by people.",development,kitchen metal.wav,44100,25.98385487528345,16.47,1.4399627874051553,1.8897832361226363,,0.0,394381.6070032163,9463.301591979094,0.02969413453192264,"",32.893
development/crow-chatter2.wav,/root/clawd/_datasets/clotho_3490684/audio_development/development/crow-chatter2.wav,A variety of birds singing and chirping and air moving in the background.,A variety of birds singing and chirping and air moving in the background.,A variety of birds singing and chirping and are moving in the background.,Birds call out while another species of bird chirps.,Multiple seagulls are squawking angrily and other birds are chirping,Several seagulls squawking angrily and other birds chirping.,development,crow-chatter2.wav,44100,17.46954648526077,28.54,1.8043140672525542,0.22647174200184997,,10.124185095790288,761.4594393231743,321.75202845053894,0.05197800139746966,"",31.536
development/FootstepsUpstairs.wav,/root/clawd/_datasets/clotho_3490684/audio_development/development/FootstepsUpstairs.wav,A person walks back and forth on a creaky wood floor,A person walks back and forth on a creaky wood floor,A person walks on a wood surface with shoes on.,A person wearing shoes walls on a wooden surface.,A wood floor creaks as a person walks back and forth upon it.,Several shoes are moving and shuffling across a creaking hard wood floor.,development,FootstepsUpstairs.wav,44100,23.42800453514739,14.535,1.2163041644926271,2.351138655937991,,0.0,237119.74636035145,6878.396496857501,0.04072523779472766,"",32.314
development/Walking on Wood Floor 2.wav,/root/clawd/_datasets/clotho_3490684/audio_development/development/Walking on Wood Floor 2.wav,"A fire crackles nearby while, in the distance, the wind howls.","A fire crackles nearby while, in the distance, the wind howls.",Almost completely silent apart from a steady shuffling percussive noise.,Almost completely silent apart from a human made percussive noise.,"Footsteps are lightly marching on pavement, going toward a location.",Someone is sitting in a chair while watching a movie on their computer.,development,Walking on Wood Floor 2.wav,44100,15.189342403628117,2.088,1.0404593408803922,2.0279193684094046,,0.0,70653.58805049882,1984.8122213470301,0.03335967028958575,"",9.019
development/hamlet Haanwijk autumn NL 03 151003_0804 ST.wav,/root/clawd/_datasets/clotho_3490684/audio_development/development/hamlet Haanwijk autumn NL 03 151003_0804 ST.wav,"At first, several people are conversing, followed by birdsong, and finally the people shuffle around.","At first, several people are conversing, followed by birdsong, and finally the people shuffle around.","Birds chirp, air moves, and people talk in the distance while a hard object strikes another.","Birds chirping, air movement, people talking in the distance and one hard object striking another.","People talk and then birds sing, and at the end people are shuffling around.","Several birds are tweeting and chirping, followed by a shuffling noise.",development,hamlet Haanwijk autumn NL 03 151003_0804 ST.wav,44100,27.183537414965986,19.56,1.9095998934742162,4.088149476251275,,0.0,14733.605681523199,903.0670894727274,0.02471005036633619,"",45.939
development/Fog in the trees with wind.wav,/root/clawd/_datasets/clotho_3490684/audio_development/development/Fog in the trees with wind.wav,A radio is not in a good frequency and is on a bad channel.,A radio is not in a good frequency and is on a bad channel.,A waterfall flows into a small pond of water.,A waterfall that is falling into a small pond of water.,Rain falls at a constant rate while water drips and flows.,The rain continues steadily and water drips at the same time.,development,Fog in the trees with wind.wav,44100,15.307052154195011,23.38,1.5503285182695978,2.3322122001507926,,0.0,165.83933959360076,121.63400271699138,0.011438681187389483,"",22.181
development/CarWash.wav,/root/clawd/_datasets/clotho_3490684/audio_development/development/CarWash.wav,A group of people working in a place with machinery.,A group of people working in a place with machinery.,A group people in an work place with machinery,A truck was driving out of a garage,"It is raining, the wind is blowing and a car drives by.",The wind blew as a car drove by in the rain,development,CarWash.wav,44100,15.869501133786848,33.43,1.4214495350713594,0.1103370281125302,,0.0,468.95957860868816,185.70658417879764,0.061290829315730086,"",32.581
