id,audio_path,text,caption_1,caption_2,caption_3,caption_4,caption_5,split,file_name,sample_rate,duration_s,loudness,sharpness,roughness,fluctuation_strength_proxy,pr_ecma_st,fluctuation_evr,fluctuation_ami,fluctuation_rms_mod,error,compute_time_s
development/LargeStreamOverLoginForestMarch.wav,/root/clawd/_datasets/clotho_3490684/audio_development/development/LargeStreamOverLoginForestMarch.wav,Rapid water is going and falling down the river,Rapid water is going and falling down the river,The bathtub grew filled as the water slowly left the faucet.,The river water is moving rapidly and falling down.,Water flowing down into a creek at a pretty fast rate.,Water flowing down to a creek at a pretty fast rate.,development,LargeStreamOverLoginForestMarch.wav,44100,15.00108843537415,41.94,1.73859097051222,0.27354462920732436,,0.0,374.2872531288053,168.23753340291253,0.0301616354282943,"",33.168
development/ascensorbibliotecaViladeGracia.wav,/root/clawd/_datasets/clotho_3490684/audio_development/development/ascensorbibliotecaViladeGracia.wav,A horn beeps in the distance while people talk in garage.,A horn beeps in the distance while people talk in garage.,A machine is running with the stepping and voice of a person,A person opening a door and machine whirring noises and people talking in the background.,People talk in garage and a horn beeps in the distance.,Someone is riding an elevator up and got off.,development,ascensorbibliotecaViladeGracia.wav,44100,27.09768707482993,11.041,1.2555359633229144,1.2331997344570347,,0.0,32741.941941435,1394.172813053552,0.10098670765915893,"",33.877
development/Crowd_Large_Large Venue_Tradeshow.wav,/root/clawd/_datasets/clotho_3490684/audio_development/development/Crowd_Large_Large Venue_Tradeshow.wav,A crowd of passengers were talking in a moving bus with a loud engine.,A crowd of passengers were talking in a moving bus with a loud engine.,Industrial machinery is in operation while factory workers chat to one another.,Machinery running and people conversing in close proximity to each other.,Multiple distant conversations that are in a busy area.,Various far away conversations are being held in a busy area.,development,Crowd_Large_Large Venue_Tradeshow.wav,44100,25.770521541950114,35.93,1.2366555167681674,0.7549643468732999,,0.0,1164.393230509529,268.58404318485964,0.029719201898472977,"",47.884
development/in the cafe.wav,/root/clawd/_datasets/clotho_3490684/audio_development/development/in the cafe.wav,"An engine runs briefly, men and women are speaking, and a child yells in background.","An engine runs briefly, men and women are speaking, and a child yells in background.",Men and women are speaking as children yell in the background while an engine runs briefly.,People are talking nearby and a child is yelling in the background.,People have a conversation over a child screaming nearby.,engine noise with children screaming and people talking in the background,development,in the cafe.wav,44100,19.12829931972789,23.56,1.2156834304939987,0.43984170685366913,,0.0,2727.4397703925943,472.06481651772623,0.04899689615336644,"",30.567
development/pajaritos_hifi_.wav,/root/clawd/_datasets/clotho_3490684/audio_development/development/pajaritos_hifi_.wav,A bird chirps with increasing frequency and intensity.,A bird chirps with increasing frequency and intensity.,Birds whistle and chirp which then echo out.,Multiple birds whistle and chirp followed by high pitched echos.,Several birds flying back and forth as they tweet.,Several birds tweeting as they fly back and forth,development,pajaritos_hifi_.wav,44100,26.23854875283447,13.62,3.5699947708294344,1.8050661828747696,,10.248652576914402,10506.395105427257,1147.0062896556622,0.05561261159667131,"",30.034
development/0111 Ambulance.wav,/root/clawd/_datasets/clotho_3490684/audio_development/development/0111 Ambulance.wav,A car with a siren passes by and then a bicycle passes by.,A car with a siren passes by and then a bicycle passes by.,A police car with the siren turned on driving around.,Sirens sound as a vehicle drives by along with other vehicles.,Sirens sound as vehicles pass along each other.,"The cars on the street are quiet but an ambulance silence approaches, wailing, and then fades as it passes.",development,0111 Ambulance.wav,44100,21.060498866213152,20.28,1.2398803474994455,0.7432398093118114,,0.0,185071.22298126016,5551.527382933824,0.057659411333036203,"",29.996
"development/Cassette player switch on, Fat hum through tiny speaker.wav","/root/clawd/_datasets/clotho_3490684/audio_development/development/Cassette player switch on, Fat hum through tiny speaker.wav",A machine is vibrating and making low frequency humming sounds.,A machine is vibrating and making low frequency humming sounds.,An airplane flying through the air at a steady pace,An engine is making a continuous low pitched sound.,a machines is making vibrating low humming sounds,an engine is making a continuous bass sound,development,"Cassette player switch on, Fat hum through tiny speaker.wav",44100,19.707324263038547,24.11,0.7712652998835805,0.8265247749534389,,0.0,1891.298308928369,246.03389913469297,0.08612087351263945,"",28.013
development/flyingmachine+birds.wav,/root/clawd/_datasets/clotho_3490684/audio_development/development/flyingmachine+birds.wav,"An airplane drones overhead, while birds chirp in the distance.","An airplane drones overhead, while birds chirp in the distance.",Birds are chirping and an airplane flies overhead.,Birds are heard chirping and the sound of an engine is heard in the background.,Chirping birds are interrupted by a propeller plane passing by.,an airplane can be heard flying overhead as birds chirp in the background,development,flyingmachine+birds.wav,44100,28.5,16.67,0.9886900171236549,0.15593776219247057,,18.064541660646555,4775200.490334496,35045.84281621437,0.02528993123606639,"",31.309
development/20070814.Copenhagen.04.wav,/root/clawd/_datasets/clotho_3490684/audio_development/development/20070814.Copenhagen.04.wav,A vehicle driving in the background with some female voices in the background,A vehicle driving in the background with some female voices in the background,Children scream and play in the rain as people talk.,People chatting at the train station or around vehicles.,People walking and conversing in close proximity with traffic flowing by.,people are talking children are screaming and playing in the rain,development,20070814.Copenhagen.04.wav,44100,21.70485260770975,30.43,1.468632423993137,0.1339395879247294,,0.0,5019.834223892504,991.1196908008585,0.027756017093570232,"",42.3
"development/09-07-11_0732_Ribeira early morning, next to the river, ducks.wav","/root/clawd/_datasets/clotho_3490684/audio_development/development/09-07-11_0732_Ribeira early morning, next to the river, ducks.wav",A duck is quacking loudly and another duck is also quacking softly in the background.,A duck is quacking loudly and another duck is also quacking softly in the background.,Ducks quack loudly while other birds chirp in the background.,Ducks quacking loudly while other birds chirp in the background.,Several ducks are quacking with birds chirping in the background.,"Two ducks quack, one loudly and one softly.",development,"09-07-11_0732_Ribeira early morning, next to the river, ducks.wav",44100,19.25498866213152,17.75,1.6069768453574889,0.4789503575669201,,0.0,26940.31053282964,1718.7319807847978,0.056846307378448487,"",25.448
development/Babble of Frogs 001.wav,/root/clawd/_datasets/clotho_3490684/audio_development/development/Babble of Frogs 001.wav,"A duck is quacking while other birds are chirping,","A duck is quacking while other birds are chirping,",Several ducks quacking outside with smaller birds chirping,Smaller birds are chirping as ducks quack outside.,The ducks are quacking in the water of the pond.,While a number of birds are chirping a duck is quacking.,development,Babble of Frogs 001.wav,44100,21.785918367346937,12.345,1.3748990632495803,2.4070442078667753,,0.0,1534.8747938897181,880.3010867170703,0.03471315694398181,"",24.226
development/mountain river 06-09-2012.wav,/root/clawd/_datasets/clotho_3490684/audio_development/development/mountain river 06-09-2012.wav,"A large volume of water is rushing, splashing and gurgling all the time.","A large volume of water is rushing, splashing and gurgling all the time.","A large volume of water is rushing, splashing and gurgling consistently.",River waves flow and crash against the many rocks on the river bed.,Water flows continuously in the rock filled stream.,lots of rain coming down and falling off the roof top.,development,mountain river 06-09-2012.wav,44100,29.62562358276644,29.66,1.6389796797119522,0.37695213246118375,,0.0,757.4596422155529,235.03503751591896,0.011196429141414365,"",61.112
development/River 2.wav,/root/clawd/_datasets/clotho_3490684/audio_development/development/River 2.wav,A Continuous flow of water is running into a stream.,A Continuous flow of water is running into a stream.,A flow of water is running in a creek bed.,Continuous flow of water running in a stream.,Water from a small stream flows and runs against rocks.,"Water from a small stream flows, making a splash as it runs against rocks.",development,River 2.wav,44100,25.214081632653063,21.6,1.8297547500285964,0.6342804522130507,,0.0,3309.394199838157,665.1584380810982,0.01548094313007844,"",50.86
development/BOAT INTERIOR ENGINE.wav,/root/clawd/_datasets/clotho_3490684/audio_development/development/BOAT INTERIOR ENGINE.wav,"A humming motor, numerous people chattering while a man coughs.","A humming motor, numerous people chattering while a man coughs.",Heavy machinery hums consistently while people murmur in the background.,"Humming from a motor, numerous people chattering while a man coughs.",Several men and women speak in a noisy background while someone coughs.,several men and women speaking in a noisy background and someone coughing,development,BOAT INTERIOR ENGINE.wav,44100,22.419977324263037,21.91,0.7892685520387719,3.8073550119242214,,25.055693896007305,388.146185220575,169.58876609014908,0.056084358644820705,"",30.454
development/waves.wav,/root/clawd/_datasets/clotho_3490684/audio_development/development/waves.wav,As the water moved around I was being splashed.,As the water moved around I was being splashed.,Birds sing and chirp as water splashes against nearby rocks.,Water is being moved around and being splashed.,Water splashed rhythmically with birds chirping and wind blowing in the background.,Water splashing rhythmically with birds chirping and light wind in the background.,development,waves.wav,44100,26.626643990929704,30.54,1.5866444893500529,1.975468181316014,,0.0,33315.39033747241,2052.4132654650143,0.037609428663285385,"",52.825
development/Thunder.wav,/root/clawd/_datasets/clotho_3490684/audio_development/development/Thunder.wav,"As a steady rain falls, thunder rolls in the distance.","As a steady rain falls, thunder rolls in the distance.",Heavy rain falls during a thunderstorm from the porch of someone.,Heavy rains are falling down along with rolling thunder,Heavy rains falling down along with rocking thunder,Thunder rolls in the distance as a steady rain falls.,development,Thunder.wav,44100,22.16344671201814,15.918,1.0878355979788696,3.144551077409692,,0.0,12695.094394244892,1408.5613651173285,0.07771558482635767,"",31.567
development/machine1.wav,/root/clawd/_datasets/clotho_3490684/audio_development/development/machine1.wav,A machine is being ran at a constant rate while cars pass by quickly.,A machine is being ran at a constant rate while cars pass by quickly.,A machine is running at a constant rate while cars pass by quickly.,A truck is running while sitting in some traffic.,A truck is running while sitting in traffic.,Traffic speeds by as an audio recorder plays loudly.,development,machine1.wav,44100,21.02702947845805,39.46,2.156671775379677,0.11641719676873179,,0.0,580.3392943429714,202.42790805058598,0.023413133077470324,"",49.296
development/Plant noises.wav,/root/clawd/_datasets/clotho_3490684/audio_development/development/Plant noises.wav,"A person is rustling through leaves and sticks, getting louder as they get closer.","A person is rustling through leaves and sticks, getting louder as they get closer.",Footsteps growing louder as they approach crunching on leaves.,Multiple branches are being cut down in the forest with the leaves being crunched down and rustling.,Multiple branches are cut down as leaves are crunched and rustling.,Someone is shuffling items around before breathing and dropping an item into a bucket.,development,Plant noises.wav,44100,25.28718820861678,12.003,2.3520713138210283,1.8909520221887606,,0.0,1973006.0206085811,53868.05747027926,0.015151507138254718,"",32.825
development/Horse_Hooves_Hard_Floor_Interior.wav,/root/clawd/_datasets/clotho_3490684/audio_development/development/Horse_Hooves_Hard_Floor_Interior.wav,"A person is walking with high heels on, down the hallway","A person is walking with high heels on, down the hallway",Hard nails are clacking on a hard surface.,"Hard objects are striking against another hard object in a regular, even way.","Hard objects striking against other hard objects in a regular, even way.",The clacking of hard nails on a hard surface.,development,Horse_Hooves_Hard_Floor_Interior.wav,44100,16.950566893424035,14.962,1.4221711239004122,4.683653423522259,,0.0,125403.1186699672,3449.149790811832,0.02650524713101989,"",16.237
"development/Powell Street Festival - Omikoshi - Aug 1, 2009.wav","/root/clawd/_datasets/clotho_3490684/audio_development/development/Powell Street Festival - Omikoshi - Aug 1, 2009.wav",A crowd of people speaking while a marching band performs.,A crowd of people speaking while a marching band performs.,A drum is beating at a crowded gathering.,People talking while others chant to the beat of a drum and whistle in the background.,Playing of drums while a whistle blows and a lot of people are chatting.,"While some people talk, others chant and whistle in rhythm with the drums.",development,"Powell Street Festival - Omikoshi - Aug 1, 2009.wav",44100,22.702607709750566,21.37,1.1028129538343492,1.1019857454401216,,0.0,7274.6719979632835,613.8718207481814,0.09070537477800221,"",33.896
"development/a gentle breeze, wind 1.wav","/root/clawd/_datasets/clotho_3490684/audio_development/development/a gentle breeze, wind 1.wav",A huge gust of wind whistles and howls.,A huge gust of wind whistles and howls.,Wind blowing by in a very open area near someone.,Winds that are howling and whistling are powerful high,the strong wind is rumbling and howling and blowing branches away,"the strong wind is rumbling, howling and blows branches away",development,"a gentle breeze, wind 1.wav",44100,16.773469387755103,30.7,1.0745032157390795,0.1946036511567271,,0.0,1232.4779648693764,336.3474431622217,0.03458962107233781,"",27.87
development/Train Internationaal Benelux 090627.wav,/root/clawd/_datasets/clotho_3490684/audio_development/development/Train Internationaal Benelux 090627.wav,A city rail train is coming in for a landing and its brakes are squealing.,A city rail train is coming in for a landing and its brakes are squealing.,A huge vehicle passes by on the road and metal is vibrating.,"A subway slows as it approaches the station, and then quickly passes it without stopping.","Outside in the road, a huge vehicle passing by, a metal vibrating",a subway approaches a station and then passes it without stopping.,development,Train Internationaal Benelux 090627.wav,44100,29.106009070294785,26.52,1.3118027206092422,0.2233003473978166,,0.0,14141.640109827284,2073.310887011738,0.03245435133110885,"",46.077
development/CarApproaching_Asphalt_leaves.wav,/root/clawd/_datasets/clotho_3490684/audio_development/development/CarApproaching_Asphalt_leaves.wav,A moving truck approached slowed down and then stopped,A moving truck approached slowed down and then stopped,A moving truck approaches then slows down and stops.,"A vehicle motor first accelerates then idles then stops, followed by clicks","An engine roars to life, idles, and then stops.",Rushing air becomes closer as vehicles pass by squealing to a slow stop.,development,CarApproaching_Asphalt_leaves.wav,44100,19.59764172335601,24.77,1.6570634467300311,0.15087780027393125,,0.0,180422.8976620283,6036.110217893859,0.02756718742219893,"",35.214
development/20100327.plastic.bag.wav,/root/clawd/_datasets/clotho_3490684/audio_development/development/20100327.plastic.bag.wav,A large machine is operating at a fast pace.,A large machine is operating at a fast pace.,A large machine is running at a very fast speed.,A piece of plastic is rustling in the wind.,Someone is shaking a container filled with beads.,The wind causes a piece of plastic to rustle.,development,20100327.plastic.bag.wav,44100,19.05934240362812,27.29,2.5705114897216204,0.3651864548571977,,0.0,78431.67364919641,1926.605325237502,0.030750430715343908,"",44.255
development/Rosary.wav,/root/clawd/_datasets/clotho_3490684/audio_development/development/Rosary.wav,A muffled noise as one object rubs against another object.,A muffled noise as one object rubs against another object.,Beads rattle around noisily as time goes on and on.,Beads rattle around noisily as time goes on.,The walking stick taps very lightly as the man shuffles across the room and scrapes the dinner plate.,Very light tapping and shuffling followed with scraping.,development,Rosary.wav,44100,17.293718820861677,10.447,2.0535946195728045,4.750779850689325,,0.0,10765.048080451146,1570.8769169357013,0.022935347460858697,"",27.024
development/Mensen op de achtergrond.001.wav,/root/clawd/_datasets/clotho_3490684/audio_development/development/Mensen op de achtergrond.001.wav,A bunch of people are talking in the background while a man talks to another.,A bunch of people are talking in the background while a man talks to another.,A large gathering of people are talking and socializing outside.,A large gathering of people talking and socializing outdoors.,People chatting in a large public space outdoors during the day with children.,People chatting outdoors while some are children playing.,development,Mensen op de achtergrond.001.wav,44100,16.0,26.43,1.4731908969343066,1.1581506726566333,,0.0,269.26193189736074,180.38678853709214,0.03045833380546344,"",31.51
development/PassingCars01.wav,/root/clawd/_datasets/clotho_3490684/audio_development/development/PassingCars01.wav,"Birds chirp and chatter happily, as cars zoom by in the background.","Birds chirp and chatter happily, as cars zoom by in the background.",Birds chirp happily as cars zoom by in the background.,Cars driving down a street while birds are tweeting in the background.,Multiple vehicles passing by on a road with birds chirping in the background.,Vehicles are running on a highway and birds are chirping in the trees.,development,PassingCars01.wav,44100,23.80655328798186,22.5,1.4776816933959382,0.33339301384880154,,0.0,9196.666480846858,1162.3347837390513,0.007435087720683416,"",36.445
development/Railway maintenance works.wav,/root/clawd/_datasets/clotho_3490684/audio_development/development/Railway maintenance works.wav,"After closing the door and roaring the motor, the vehicle with the noise rolled by.","After closing the door and roaring the motor, the vehicle with the noise rolled by.","As two cars zoom by, someone opens the door, steps out, and closes it.",The train is speeding down the tracks and it is picking up speed as it passes.,The train is speeding down the tracks picking up speed as it passes.,"closing door, motor roaring, then approaching vehicle, rolling noise passing by",development,Railway maintenance works.wav,44100,22.494557823129252,37.78,1.4284709388842716,0.22157731579489823,,0.0,12052.039523317073,1129.6070583900994,0.03607076156131262,"",45.149
development/tata_hungary__roundabout_with_fountain_20080718.wav,/root/clawd/_datasets/clotho_3490684/audio_development/development/tata_hungary__roundabout_with_fountain_20080718.wav,A car on the road passes by quickly.,A car on the road passes by quickly.,A car passes by quickly on the road,"A vehicle approaches, drives by, and then drives away.",Cars drive by a single point on the road.,vehicle approaches real fast and passes by with a zoom,development,tata_hungary__roundabout_with_fountain_20080718.wav,44100,18.677641723356007,18.45,1.4349895238617059,0.2123402186806544,,0.0,366712.1399443047,7540.602175782128,0.02414120332346826,"",29.096
development/Filing Nails.wav,/root/clawd/_datasets/clotho_3490684/audio_development/development/Filing Nails.wav,A person is filing a piece of metal with a metal file.,A person is filing a piece of metal with a metal file.,A person uses the metal file to file a piece of metal.,Someone keeps sharpening a knife on a stone,Someone was continuously filing a knife on a stone,Two objects are rubbing together and making noises.,development,Filing Nails.wav,44100,29.26875283446712,3.218,3.338476791177176,3.453914877289301,,0.0,23349.382445739764,5806.336179378841,0.0019908887441477453,"",24.42
development/20160718_fountain.03.wav,/root/clawd/_datasets/clotho_3490684/audio_development/development/20160718_fountain.03.wav,Water flowing down a waterfall and into a pond.,Water flowing down a waterfall and into a pond.,Water flowing down an indoor artificial waterfall that is indoors.,Water flows consistently into another container of water.,Water flows consistently into another object with water.,Water is flowing into a basin and down a drain.,development,20160718_fountain.03.wav,44100,23.740793650793652,26.77,1.6440879631238419,1.5605039846569024,,0.0,3239.9396525760894,501.25138295085515,0.028455184579525884,"",47.888
development/2nd Half of a Freight Train.wav,/root/clawd/_datasets/clotho_3490684/audio_development/development/2nd Half of a Freight Train.wav,A loud engine is whirring while a train passes by.,A loud engine is whirring while a train passes by.,A track  is rolled over by a train as it rumbles.,A train rumbles along over a track intersection.,"Metal clanging and rattling resonate as a train chugs along, the wheels rumbling along the track.",an engine is whirring while a train passes by,development,2nd Half of a Freight Train.wav,44100,15.715646258503401,24.88,1.6194443067607784,0.2840421911829856,,0.0,44735.977002532396,1821.1287100022735,0.049147715004109804,"",30.808
development/At Broadsands overlooking Hookhills Viaduct on the Dartmouth Steam Railway.wav,/root/clawd/_datasets/clotho_3490684/audio_development/development/At Broadsands overlooking Hookhills Viaduct on the Dartmouth Steam Railway.wav,A moving machine is making a very loud clanging noise.,A moving machine is making a very loud clanging noise.,A train chugs along past the station and grows quieter.,A train engine is chugging along the tracks.,Along the train tracks a train engine is chugging.,a very loud clanging from a moving machine,development,At Broadsands overlooking Hookhills Viaduct on the Dartmouth Steam Railway.wav,44100,22.760113378684807,24.58,1.208307423923858,1.3878203798620765,,0.0,9594.749985267226,600.5170577329969,0.05235876927657818,"",33.593
development/Shuttle-Train-Passing.wav,/root/clawd/_datasets/clotho_3490684/audio_development/development/Shuttle-Train-Passing.wav,A train chugs along a track and blares its horn.,A train chugs along a track and blares its horn.,A train is chugging down the tracks while blowing its horn.,"After a loud bus horn beeps, the clicking of a train get closer and then fades away.","After a loud bus horn, the clicking of a train get closer and then fades away.","As a train moves down the tracks, it blows its horn.",development,Shuttle-Train-Passing.wav,44100,20.96761904761905,27.15,1.6519975450729663,1.2611537795931511,,0.0,7045386.616709901,40177.0393031022,0.03543822487277553,"",36.649
development/taps.wav,/root/clawd/_datasets/clotho_3490684/audio_development/development/taps.wav,The water was rushing into the sink and down the drain at various rates.,The water was rushing into the sink and down the drain at various rates.,Water from a faucet is running into a sink.,Water is flowing from a pot or container into a cup.,Water is poured from a pot into a cup.,Water is running from a faucet into a sink.,development,taps.wav,44100,29.770612244897958,17.17,2.2979897378858394,1.2393534874541081,,0.0,176320.58823361597,5022.811850723072,0.008074249505650027,"",52.817
development/Airplane indoor ambience .wav,/root/clawd/_datasets/clotho_3490684/audio_development/development/Airplane indoor ambience .wav,A busy train with some plastic being moved with clicking.,A busy train with some plastic being moved with clicking.,A heavy machine was continuously working and blowing air.,An heavy machine was continuously working and blowing air.,"In foreground, a busy train, plastic being removed and clicking.","The wind is blowing against a car that is moving too fast, causing the car to slide off the road.",development,Airplane indoor ambience .wav,44100,26.2624716553288,35.64,1.0193494407348191,1.3754737416159197,,0.0,1206.1181581640021,268.6876402926587,0.06788881884299564,"",46.294
development/car_starting_and_shouts_far_away.wav,/root/clawd/_datasets/clotho_3490684/audio_development/development/car_starting_and_shouts_far_away.wav,A dog barks once and then barks two more times.,A dog barks once and then barks two more times.,A dog barks quietly in the background while a vehicle accelerates .,"A dog is barking, and a soft, whispering wind blowing.",Dogs bark while a vehicle passes by and the wind blows.,vehicle travelling sound and wind blowing sound and some dogs barking sound,development,car_starting_and_shouts_far_away.wav,44100,21.80265306122449,6.406,1.3999437929170604,0.28387513513456536,,0.0,50022.12179169779,3587.9357434291114,0.039108839918802846,"",23.108
