id,audio_path,text,caption_1,caption_2,caption_3,caption_4,caption_5,split,file_name,sample_rate,duration_s,loudness,sharpness,roughness,fluctuation_strength_proxy,pr_ecma_st,fluctuation_evr,fluctuation_ami,fluctuation_rms_mod,error,compute_time_s
development/ZOOM0001.wav,/root/clawd/_datasets/clotho_3490684/audio_development/development/ZOOM0001.wav,A group of men and women are having a discussion in a room of people.,A group of men and women are having a discussion in a room of people.,A man and two women are conversing as a large crowd chatters in the background.,"In a room full of people, a group of men and women are having a discussion.",Several people chatting in a room in a restaurant.,Several people were having a chat in the restaurant.,development,ZOOM0001.wav,44100,28.973990929705217,17.88,1.3460166157919673,2.3624273854370506,,0.0,117873.0503358357,7693.065967533025,0.04192630131091443,"",47.08
development/babbling brook 2.wav,/root/clawd/_datasets/clotho_3490684/audio_development/development/babbling brook 2.wav,A small fountain running water down it and bubbling it up.,A small fountain running water down it and bubbling it up.,"Water babbling at a steady pace, with some light outdoor ambient sound.",Water is bubbling out of a fountain and forming a pool.,Water runs down and bubbles up through a fountain.,"a fountain pours water out, bubbling into a pool.",development,babbling brook 2.wav,44100,15.20968253968254,19.75,1.9905727018120019,1.4828767631695208,,0.0,3956.6759858459427,420.49455106988427,0.03207534170944427,"",30.509
development/20090619.air.conditioner.wav,/root/clawd/_datasets/clotho_3490684/audio_development/development/20090619.air.conditioner.wav,A motor is started up and left running for a while,A motor is started up and left running for a while,A motor is started up and stays on for a while,A steady and consistent engine hums and vibrates.,An engine humming and vibrating consistently and steadily,An engine hums continuously making little change in pitch.,development,20090619.air.conditioner.wav,44100,23.02437641723356,40.67,1.376604428540648,0.2962812568788315,,0.0,314.7691109747562,149.40855480603284,0.026149079008254545,"",46.635
development/LA Rain.wav,/root/clawd/_datasets/clotho_3490684/audio_development/development/LA Rain.wav,"A low, mechanical whir dies down while rainfall resonates in the background.","A low, mechanical whir dies down while rainfall resonates in the background.",A machine is running and the rain is pouring down.,An engine is running and the rain is pouring down.,Rain streams down over a bustling city road.,Rain trickles down over a busy city street.,development,LA Rain.wav,44100,27.87891156462585,41.81,1.5936128003015497,0.28886753739654925,,0.0,1940.0169932643985,389.4277736041509,0.022751516425781788,"",60.646
development/20100403.Brussels.ambulance.wav,/root/clawd/_datasets/clotho_3490684/audio_development/development/20100403.Brussels.ambulance.wav,A crowd gathers outside as a warning signal sounds and then a siren begins to blare.,A crowd gathers outside as a warning signal sounds and then a siren begins to blare.,"An emergency siren is going off, people talk and a vehicle siren goes off.",An vehicle emergency siren blares while people talk in the background.,As an emergency siren blares people talk then a vehicle siren goes off,"The city street hums with vehicles, including the wailing siren of an ambulance.",development,20100403.Brussels.ambulance.wav,44100,27.683015873015872,40.41,1.3679553157089173,1.3095510500484502,,14.272361351712526,3187.887573375984,474.11638012821095,0.05564335989340647,"",51.695
development/20110121_stream.M10.wav,/root/clawd/_datasets/clotho_3490684/audio_development/development/20110121_stream.M10.wav,"As rain steadily falls, some water splashes on ground, and some gathers in puddles","As rain steadily falls, some water splashes on ground, and some gathers in puddles",Rain is falling heavily into a pool making a faint bubbling noise.,Raining heavily into a pool with faint bubbling noise,Water flowing over some rocks throughout a creek.,Water running over rocks in a creek throughout.,development,20110121_stream.M10.wav,44100,25.589591836734694,23.38,1.6915637748187338,1.4502734437972404,,0.0,876.6227212748561,261.90467572028774,0.009780040983794588,"",50.187
development/bath.wav,/root/clawd/_datasets/clotho_3490684/audio_development/development/bath.wav,A heavy rainfall is hitting the ground hard,A heavy rainfall is hitting the ground hard,A squeaky faucet handle is turned and water flows out.,"As water pours into the tub, the faucet squeaks.",The faucet squeaks as water pours into the tub.,The squealing of a faucet is followed by water coming out of it.,development,bath.wav,44100,19.87734693877551,23.91,2.1905823986293185,0.8371688204003446,,0.0,693.7479369951843,661.916055306869,0.02973151055603844,"",43.162
development/shells-tinkle.wav,/root/clawd/_datasets/clotho_3490684/audio_development/development/shells-tinkle.wav,A wind chime and bells begin to toll.,A wind chime and bells begin to toll.,A wind chime is being pushed and the bells are ringing.,Jingling light items clang together not too loud constantly.,Wind chimes making noise as they clink together,Wind chimes making sound as they crash and clink together.,development,shells-tinkle.wav,44100,17.243333333333332,8.166,3.9241565766948514,3.5179925885492427,,9.494779321473935,18422.91879869546,1987.9712711596928,0.019367300857974872,"",28.994
development/20141026 Bangkok House Traffic Thunder Bird 01.wav,/root/clawd/_datasets/clotho_3490684/audio_development/development/20141026 Bangkok House Traffic Thunder Bird 01.wav,Birds are singing while vehicles and approach and drive away in background.,Birds are singing while vehicles and approach and drive away in background.,Birds are singing while vehicles approach and then drive off into the distance.,"Outside in the street, a bunch of birds chirp and tweet.",Something creaks lightly followed by a passing vehicle.,Something creeks lightly and a vehicle passes by.,development,20141026 Bangkok House Traffic Thunder Bird 01.wav,44100,26.612789115646258,17.69,1.31406209682209,0.15667572637734678,,12.034270472949437,5627.996854195377,747.0511260795676,0.05516814402001452,"",38.743
development/household noise.wav,/root/clawd/_datasets/clotho_3490684/audio_development/development/household noise.wav,A person is walking and then a door creaks open.,A person is walking and then a door creaks open.,"As a car passes by, a creak in the road occurs.","The creaking of something metallic and soft steps,",Waves from creeks are peacefully crashing along artificial objects.,a wooden chair is creaking noisily as it repetitively rocks.,development,household noise.wav,44100,27.846780045351473,17.92,1.1964260938768398,0.805678592452113,,0.0,12285.664921210411,1117.2832582562992,0.03681422694167331,"",35.473
development/8 minutes in one.wav,/root/clawd/_datasets/clotho_3490684/audio_development/development/8 minutes in one.wav,As a machine is runs in an enclosed space people speak in the background.,As a machine is runs in an enclosed space people speak in the background.,Static with a faint noise of men talking in the background.,The noise level around the airplane is high due to the engines being active.,The vacuum cleaner is being operated while the television is on.,While the television is on the vacuum cleaner is being operated,development,8 minutes in one.wav,44100,25.69950113378685,57.03,1.441478457446437,0.3104589944263018,,0.0,1105.9062855804762,234.2367512608864,0.07066085714698032,"",50.778
development/A bird sing alone in the alpine forest.wav,/root/clawd/_datasets/clotho_3490684/audio_development/development/A bird sing alone in the alpine forest.wav,A bird chirping repetitively as a waterfall echoes nearby.,A bird chirping repetitively as a waterfall echoes nearby.,A bird chirping repetitively sitting beside a waterfall,Electrical buzzing is accompanied by low humming as a bird chirps repeatedly.,"While vehicles drive in the background, a bird cries.",birds are chirping continuously in the forest over a long period of time,development,A bird sing alone in the alpine forest.wav,44100,28.584739229024944,22.6,1.6495458341152864,0.29937147811663795,,0.0,291.29144295364046,242.47421461074907,0.05204187169755925,"",56.419
development/chinatown_park.wav,/root/clawd/_datasets/clotho_3490684/audio_development/development/chinatown_park.wav,"Birds are chirping, a flute is playing, and people are talking.","Birds are chirping, a flute is playing, and people are talking.",Birds chirp and a flute plays in the background as people talk.,Birds chirp while people speak and instruments are played.,Music plays faintly while multiple types of birds chirp and people converse.,Music plays in the background as a variety of birds chirp and sing and people talk in the foreground.,development,chinatown_park.wav,44100,21.160566893424036,36.98,1.5197260308409732,0.23648838171153552,,0.0,2047.1317397832956,335.44975234015556,0.03568379069813682,"",35.372
development/Fish eagle call.wav,/root/clawd/_datasets/clotho_3490684/audio_development/development/Fish eagle call.wav,A whistle being blown softly joined by a second whistle.,A whistle being blown softly joined by a second whistle.,Two people blow through musical whistles with different tones in a random fashion.,Someone is blowing a wind instrument like a recorder but not playing a tune.,"This is the sound of a whistle, a flute, or a recorder.",this is the sound of a whistle or a flute or a recorder or other similar instrument,development,Fish eagle call.wav,44100,22.56800453514739,2.328,1.670083660453228,0.107250713247085,,44.88503736721691,34208.905232522375,2484.943594388993,0.0026688663883392048,"",6.816
development/Interior Ambience Large Hall Baby Cries in Background.wav,/root/clawd/_datasets/clotho_3490684/audio_development/development/Interior Ambience Large Hall Baby Cries in Background.wav,Faint voices and movement far away continues throughout.,Faint voices and movement far away continues throughout.,Faint voices continue along with far away movement.,Quiet city noises are interrupted by a squeaky screen door opening.,Relatively quiet until a door squeaks open and then becomes quiet again.,The very low rumble of a city is broken by a screen door opening with a squeak.,development,Interior Ambience Large Hall Baby Cries in Background.wav,44100,19.528707482993198,6.495,1.3836802491656817,1.939772673149213,,0.0,29953.03849006866,3651.184327134663,0.046215075063290416,"",18.861
development/Kettle 01.wav,/root/clawd/_datasets/clotho_3490684/audio_development/development/Kettle 01.wav,"A machine begins running loudly, and the sound begins to fade.","A machine begins running loudly, and the sound begins to fade.","A machine is running loudly, and then begins to fade.",A motor is constantly running that gets increasingly louder.,A motor is getting increasingly louder as it constantly runs.,Air is moving around in a relatively small space.,development,Kettle 01.wav,44100,28.051315192743765,40.54,1.6072342212803685,0.16717534622099392,,12.259968747145749,1922.9699772196159,357.2117009701178,0.030756388507103216,"",64.096
development/AM static.wav,/root/clawd/_datasets/clotho_3490684/audio_development/development/AM static.wav,A machine is running at an irregular speed and intensity.,A machine is running at an irregular speed and intensity.,A machine is running in irregular speed and intensity.,Crickets are chirping and an engine is in the background.,"Crickets are chirping loudly, while off in the distance, a car engine rumbles softly in the background.","On a hot summer day, insects vocalize, or an engine drones.",development,AM static.wav,44100,27.921995464852607,17.55,1.5546672289899441,1.9254457228816029,,0.0,20280.291791051648,3775.583470079602,0.006548797970703561,"",42.316
development/Ambience_hum_tuning fork.wav,/root/clawd/_datasets/clotho_3490684/audio_development/development/Ambience_hum_tuning fork.wav,A large metal bell is struck and vibrates,A large metal bell is struck and vibrates,A large metal plate is rung and echoes and vibrates.,A musical instrument hums at the beginning and echoes afterwards.,Something electrical is making a low humming sound.,The vibrating of the large metal bell follows it being struck.,development,Ambience_hum_tuning fork.wav,44100,17.147936507936507,30.1,0.9948394190086091,0.1683947135127034,,19.950636795705986,8885.643444868485,858.533184368515,0.03370845238848777,"",17.289
development/Lift running - doors close and open.wav,/root/clawd/_datasets/clotho_3490684/audio_development/development/Lift running - doors close and open.wav,"A banging over howling wind, then squeaking and footsteps growing louder.","A banging over howling wind, then squeaking and footsteps growing louder.","A fan is turned on, followed by metallic squeaking, with guitar music in the distance.",Someone is rolling a cart down the hall after putting something in it and picks up more stuff.,Someone opening a garage door slowly and then closing it.,Someone rolls a cart down the hall after putting something in it and picking up more stuff.,development,Lift running - doors close and open.wav,44100,29.396462585034012,12.613,1.3614704783833136,1.0369835713858067,,0.0,1265.4420699628558,510.9639574777051,0.020794806139562427,"",34.978
development/Rome Inside The Metro.wav,/root/clawd/_datasets/clotho_3490684/audio_development/development/Rome Inside The Metro.wav,A loud whirring noise starts while people are talking indistinctly in the background.,A loud whirring noise starts while people are talking indistinctly in the background.,A loud whirring noise while people are talking in the background.,A plane is landing while people are talking in the background.,"Machinery running, many people speaking and a loud speaker making announcements.","Machinery running, many people speaking out the loudspeaker making announcements.",development,Rome Inside The Metro.wav,44100,20.65485260770975,30.31,1.3928238791834744,0.3133246268916802,,0.0,5886.356126527867,943.9107332424041,0.03992955952452709,"",37.071
development/Gravel Crunch.wav,/root/clawd/_datasets/clotho_3490684/audio_development/development/Gravel Crunch.wav,A microphone is carried by someone walking over gravel.,A microphone is carried by someone walking over gravel.,A person walking along rough trail on twigs and leaves and a person crying briefly in the background.,Someone carrying the microphone is walking on gravel.,Someone is walking over gravel and the wind is blowing in the background.,Someone walking over gravel and the wind blowing in the background.,development,Gravel Crunch.wav,44100,20.0,13.957,1.4082531887151228,4.4801489924125,,0.0,608231.7359198701,11551.453264292999,0.053155121352261275,"",22.196
development/restaurant2.wav,/root/clawd/_datasets/clotho_3490684/audio_development/development/restaurant2.wav,A crowd of people talking and dishes clinking.,A crowd of people talking and dishes clinking.,"At a crowded restaurant, a baby is crying for its mother as plates are loudly banged together.",Dishes are clinking while a crowd of people talking.,People are talking in a restaurant and dishes are being stacked.,People are talking in a restaurant as dishes are being stacked.,development,restaurant2.wav,44100,29.037709750566894,31.88,1.32473316492815,0.5202969522421453,,0.0,10315.789545554702,1010.5437691995764,0.0501473944670745,"",52.424
development/STE-013-lisbon_alfama04_frenchkids.wav,/root/clawd/_datasets/clotho_3490684/audio_development/development/STE-013-lisbon_alfama04_frenchkids.wav,Children are talking to each other and their mother.,Children are talking to each other and their mother.,A group of kids are speaking among themselves.,Multiple children are talking to each other and their mother.,"In a large and open room, children talk to each other while other people are in the background.",Children are conversing and people are moving in close proximity to each other.,development,STE-013-lisbon_alfama04_frenchkids.wav,44100,16.5372335600907,25.89,1.5415599568648286,1.2291718375345628,,0.0,18142.045188948716,1611.1750910638941,0.07018042358798426,"",29.391
development/Kokar_Oppsjon_bird.wav,/root/clawd/_datasets/clotho_3490684/audio_development/development/Kokar_Oppsjon_bird.wav,A bird squawks repeatedly as a book gets closed by someone.,A bird squawks repeatedly as a book gets closed by someone.,A bird squawks repeatedly as a book is being closed.,A person walks on a path while a bird cries loudly above.,Birds chatter loudly above a far distant waterfall.,It is raining lightly while a bird shouts and a person walks.,development,Kokar_Oppsjon_bird.wav,44100,21.55687074829932,17.36,2.05473722762305,4.001605959101931,,0.0,3849.26402547407,710.7757711619623,0.020962279737496547,"",44.264
development/sogukortam.wav,/root/clawd/_datasets/clotho_3490684/audio_development/development/sogukortam.wav,A car engine is running at an idle.,A car engine is running at an idle.,A jet is travelling through the air and then making noise.,A jet is travelling through the air making noise.,A strong wind is blowing causing some mild static.,Race cars go around a track in the very far distance,development,sogukortam.wav,44100,23.825850340136054,22.01,0.8102980675127064,3.278951751775641,,0.0,83860.82424881338,2108.984781654323,0.06598281254666091,"",17.245
development/Exterior enter door large interior lobby TV revolving door exit to traffic and voices.wav,/root/clawd/_datasets/clotho_3490684/audio_development/development/Exterior enter door large interior lobby TV revolving door exit to traffic and voices.wav,"A car drives closer until a man speaks, then the car drives away.","A car drives closer until a man speaks, then the car drives away.","A car drives closer, until a man speaks and then the car drives away.",Brakes squeal from a few vehicles as they begin driving away.,People are talking while vehicles are braking and moving.,vehicles are braking and moving and people are talking,development,Exterior enter door large interior lobby TV revolving door exit to traffic and voices.wav,44100,20.949773242630386,17.68,1.3355007018190461,0.7052476951716106,,0.0,104582.20680796915,4203.10610961987,0.056708706318007784,"",34.233
