id,audio_path,text,caption_1,caption_2,caption_3,caption_4,caption_5,split,file_name,sample_rate,duration_s,loudness,sharpness,roughness,fluctuation_strength_proxy,pr_ecma_st,fluctuation_evr,fluctuation_ami,fluctuation_rms_mod,error,compute_time_s
development/crossing tracks.wav,/root/clawd/_datasets/clotho_3490684/audio_development/development/crossing tracks.wav,A machine with a spinning wheel is turning and turning at a constant rate of speed.,A machine with a spinning wheel is turning and turning at a constant rate of speed.,"In his good hands, the paper cutter cuts slices of pages.",Someone is inside a vehicle and is driving down the highway.,Someone is operating a paper cutter and cutting multiple sheets.,a machine with a spinning wheel is turning constantly,development,crossing tracks.wav,44100,21.178843537414966,13.74,0.9787323796968811,1.150736523802577,,0.0,13147.361891092862,928.5239242547586,0.06473037368576337,"",24.322
development/sheep bleating dry grass.wav,/root/clawd/_datasets/clotho_3490684/audio_development/development/sheep bleating dry grass.wav,"A couple of sheep chat, others join in, and a humans talks.","A couple of sheep chat, others join in, and a humans talks.",Several sheep are bleating in a field whilst footsteps echo in the background.,Several sheep making noise in a field and footsteps in the background.,Sheep call back and forth to each other.,"While the animals are calling out, they are continually making croaking sounds.",development,sheep bleating dry grass.wav,44100,19.286938775510205,24.4,1.6931975558644328,2.8310405658838507,,0.0,1163.6625799739913,237.06355839496615,0.028630773966773652,"",31.821
development/Rock-various hits.wav,/root/clawd/_datasets/clotho_3490684/audio_development/development/Rock-various hits.wav,A wooden block of a child is tapped on a couple of different surfaces.,A wooden block of a child is tapped on a couple of different surfaces.,A person is tapping different wood objects against one another.,A person taps various wood objects against each other,A small rock object is being tapped on another surface.,Dice being hit on not only wood but a hard plastic.,development,Rock-various hits.wav,44100,17.77233560090703,7.404,1.50311861732655,4.900399679579998,,0.0,325088.61917464115,45404.35116166541,0.005799850492611075,"",5.909
development/Glass pieces smashed.wav,/root/clawd/_datasets/clotho_3490684/audio_development/development/Glass pieces smashed.wav,A hard object is moving through a pile of leaves and twigs.,A hard object is moving through a pile of leaves and twigs.,A person is using a shovel to dig as it clangs against a rocky dirt area.,A person using a shovel digging and clanging against a rocky dirt area.,"Glass being broken, then swept across the floor, then more glass being broken.",Glass is broken and swept across the floor and then more glass is broken.,development,Glass pieces smashed.wav,44100,27.596916099773242,7.362,2.2975042394668446,3.4225519594623925,,0.0,8329.769492860032,1841.732231591901,0.006645979748106939,"",17.481
development/Rain WashingtonSt 1.wav,/root/clawd/_datasets/clotho_3490684/audio_development/development/Rain WashingtonSt 1.wav,A heavy rain with cars passing by in the background,A heavy rain with cars passing by in the background,Rain falls heavily with traffic passing by in the back.,Water flowing and a car driving away nearby.,Water was flowing down a steep surface and a car driving by,very heavy rain falling on water and a small engine in the distance,development,Rain WashingtonSt 1.wav,44100,18.016054421768708,36.68,1.7310500814718015,0.43783244669701576,,0.0,1040.1267000720763,298.7092726243917,0.03422551805274772,"",42.782
development/Street_Sounds_Night.wav,/root/clawd/_datasets/clotho_3490684/audio_development/development/Street_Sounds_Night.wav,A factory worker begins to cough while a fan blows in the background.,A factory worker begins to cough while a fan blows in the background.,"Rain falls, a door opens and a car drives by.",Someone in the busy street is coughing as a lot of cars pass by.,a factory worker coughing as a fan spins,the car is moving fast on the road past the traffic camera,development,Street_Sounds_Night.wav,44100,23.69639455782313,24.55,1.2655974033603963,0.151107683714538,,0.0,7193.725917840093,1004.3419425029281,0.07531979746885979,"",38.916
development/fulles_arroseguentse.wav,/root/clawd/_datasets/clotho_3490684/audio_development/development/fulles_arroseguentse.wav,A person crunches leaves and gravel as they walk and the wind blows.,A person crunches leaves and gravel as they walk and the wind blows.,A person crunches through leaves on the ground as they walk.,A person is walking crunching through leaves on the ground,A person is walking on leaves next to a highway.,A person walking through the woods over dead leaves.,development,fulles_arroseguentse.wav,44100,15.408095238095239,25.58,1.9024786002406935,2.42343601207487,,0.0,1146.7767629730297,520.5604444569041,0.022448306275447374,"",31.636
development/Basic Wind.wav,/root/clawd/_datasets/clotho_3490684/audio_development/development/Basic Wind.wav,A very quiet spot on the beach with no people or animals.,A very quiet spot on the beach with no people or animals.,Rain falls lightly and faint thunder rolls in the background.,Rain is falling lightly while thunder rolls in the distance.,"This spot on the beach has no other people or animals, and is very silent.",Winds blow as birds chirp and car engines roar in the distance,development,Basic Wind.wav,44100,21.774943310657598,3.486,1.23384857174425,0.2899216402875786,,0.0,23151.75049162818,2263.0931324281955,0.06217774030618512,"",21.525
development/reviewing-stand-clangs.wav,/root/clawd/_datasets/clotho_3490684/audio_development/development/reviewing-stand-clangs.wav,A small rock is hitting a tin can repeatedly in a different spot each time.,A small rock is hitting a tin can repeatedly in a different spot each time.,Some strikes an aluminum bin several times with a stick.,Somebody struck an aluminum bin several times with a stick.,Someone is taking a stick and hitting a metal barrel.,Someone uses a stick to hit a metal barrel.,development,reviewing-stand-clangs.wav,44100,15.893083900226758,13.615,1.640861204848529,2.4716539509851647,,0.0,4110.501308855462,948.1552012119009,0.029375089930812063,"",7.526
development/Landstraenverkehr bei Regen 3.wav,/root/clawd/_datasets/clotho_3490684/audio_development/development/Landstraenverkehr bei Regen 3.wav,"A few cars were passing by, driving very slowly.","A few cars were passing by, driving very slowly.",Brushes move over a vehicle in a car wash,Someone is driving through a tunnel with the windows down.,Someone is driving through a tunnel with their windows down.,a few cars driving by passing very slowly,development,Landstraenverkehr bei Regen 3.wav,44100,26.45392290249433,30.57,1.7966666371785895,0.8885211717109851,,0.0,266584.45898319024,5408.664824576409,0.02017514706345843,"",49.89
development/Ryan_CoffeeMachine.wav,/root/clawd/_datasets/clotho_3490684/audio_development/development/Ryan_CoffeeMachine.wav,A metallic drill is operated for a few seconds at a time.,A metallic drill is operated for a few seconds at a time.,A metallic drill is run for a few seconds at a time.,A person moves around a metallic object placed on a floor.,A person moving around a metallic object on a floor.,A metallic object brushes across another one continuously. ,development,Ryan_CoffeeMachine.wav,44100,21.998458049886622,25.57,2.1105106869888393,2.6490107740304243,,9.144269030883905,5223.858340212133,740.6119607130415,0.022509981525166374,"",35.115
development/pencil on paper.wav,/root/clawd/_datasets/clotho_3490684/audio_development/development/pencil on paper.wav,A person uses a marker to write on a white board.,A person uses a marker to write on a white board.,A person writes something down on one piece of paper.,A person writing something down on a piece of paper,"On a hard surface, someone is writing steadily with a pencil.",Someone is writing steadily with a pencil and paper on a hard surface.,development,pencil on paper.wav,44100,15.466167800453515,20.02,1.7323205782176945,2.577553252941814,,0.0,2981.25389012249,506.0144180947051,0.03261537576316314,"",29.841
development/British Museum ambience 2.wav,/root/clawd/_datasets/clotho_3490684/audio_development/development/British Museum ambience 2.wav,A crowd of people are talking about different things.,A crowd of people are talking about different things.,Folks speak in a crowded hall with people shuffling by,Many people are talking about many different things.,People are speaking in a crowded hall and people are shuffling by.,Some people walking all around a busy airport.,development,British Museum ambience 2.wav,44100,23.505396825396826,33.62,1.1668344124719572,0.15813157330696995,,0.0,2152.5556081288746,355.0371240519022,0.032126000431187365,"",41.651
development/OfficeSound.wav,/root/clawd/_datasets/clotho_3490684/audio_development/development/OfficeSound.wav,A conversation among people is going on and a woman is laughing.,A conversation among people is going on and a woman is laughing.,A discussion among folks begins and a lady starts to laugh.,A group of men and women are speaking.,A group of people are speaking with male and female voices.,Many people talk inside a building while cars drive outside on the street.,development,OfficeSound.wav,44100,23.015034013605444,26.37,1.3999276048796783,0.22748783044965265,,0.0,4562.542062671708,671.1362989504618,0.0412828910825231,"",43.485
development/Amb Resid Ext 001.wav,/root/clawd/_datasets/clotho_3490684/audio_development/development/Amb Resid Ext 001.wav,A car driving at a fast pace in the distance,A car driving at a fast pace in the distance,"As cars pass on the busy street, people are talking to one another.",People are talking in a city center while cars are driving and brakes are screeching.,People are talking in a hall while a race car races past them.,People have a conversation in the background while cars pass by a busy street.,development,Amb Resid Ext 001.wav,44100,23.86487528344671,28.31,1.2968721676275219,0.08418670810459443,,0.0,3822.613764643746,754.8770686811347,0.01908509823309315,"",42.436
development/CINDER BLOCK THUD IN GRASS.wav,/root/clawd/_datasets/clotho_3490684/audio_development/development/CINDER BLOCK THUD IN GRASS.wav,"A few different times, an object is tapped.","A few different times, an object is tapped.",A tapping of a object occurs a couple of times.,"Footsteps, metal object tossed to ground, more footsteps and another metal object tossed to ground.",Intermittent soft thudding followed by a light clink.,Intermittent soft thudding is followed by a light clink.,development,CINDER BLOCK THUD IN GRASS.wav,44100,18.042086167800452,5.185,0.8507489029334511,0.820248957943102,,0.0,196777.7877539014,7396.118248528339,0.041235537684860796,"",8.695
development/autospasandociudadnoche1.wav,/root/clawd/_datasets/clotho_3490684/audio_development/development/autospasandociudadnoche1.wav,A car is increasing in speed and driving quickly while people speak.,A car is increasing in speed and driving quickly while people speak.,Autos cruising along the street as people are conversing closely.,Cars driving down the road way nearby and people talking.,People are speaking while a car is quickly increasing in speed.,The accelerating vehicle drowns out the voice of a man.,development,autospasandociudadnoche1.wav,44100,16.027369614512473,23.82,1.1197550939098155,0.5442049437579112,,0.0,31622.419979649487,2216.814352827292,0.051267786926957444,"",24.843
development/Vent thrumming.wav,/root/clawd/_datasets/clotho_3490684/audio_development/development/Vent thrumming.wav,A buzzing sound from a small electrical engine.,A buzzing sound from a small electrical engine.,A machine is running in an rhythmic fashion and shoes are moving across a hard surface close by.,A machine turns a piece that is round and it emits a whine as it turns,A printer press motor is running at various intervals throughout.,A small electrical engine emits a buzzing sound.,development,Vent thrumming.wav,44100,23.04580498866213,36.73,1.7676620934435163,0.26043390729796684,,0.0,68883.74914400735,1611.9833628864399,0.05071936148480525,"",52.725
development/rumbling bones.wav,/root/clawd/_datasets/clotho_3490684/audio_development/development/rumbling bones.wav,A person playing on a electric keyboard making sound effects.,A person playing on a electric keyboard making sound effects.,A person plays an electronic keyboard producing sound effects.,A string vibrating and a drum beating continuously,"Different tones of synthetic music are popping, while low synthetic tones hum and intermittently strike.",Low synthetic tones hum and intermittently strike while different tones of synthetic music are popping.,development,rumbling bones.wav,44100,21.57857142857143,22.2,1.1081971380182962,4.747370872745745,,0.0,1807.1158790806871,436.8384263215168,0.05219267787246144,"",32.564
development/Train_LightRail_By_T0147.wav,/root/clawd/_datasets/clotho_3490684/audio_development/development/Train_LightRail_By_T0147.wav,A bell is going off and a train comes right by.,A bell is going off and a train comes right by.,A train drives by and a bell goes off.,A train passing by on the tracks rings its bell as it passes by.,A trolley train passes by and rings its bell.,A trolley train rings its bell as it passes by.,development,Train_LightRail_By_T0147.wav,44100,25.461814058956914,23.93,1.6312285604489625,0.3045545145934966,,0.0,30482.832880476126,2256.468191085277,0.043735630056666,"",43.719
development/12a_Ambient_Quarry_Low_44_16.wav,/root/clawd/_datasets/clotho_3490684/audio_development/development/12a_Ambient_Quarry_Low_44_16.wav,Children playing at the park and parents chatting.,Children playing at the park and parents chatting.,Multiple children and parents are laughing and talking.,Multiple children with their parents are laughing and talking.,People and children are milling around in a public space.,People and children are milling around in the public space.,development,12a_Ambient_Quarry_Low_44_16.wav,44100,22.244761904761905,10.588,1.3208710651316384,0.9985677567292123,,0.0,23541567.298254497,48918.365754778715,0.09608982370021067,"",28.998
development/beach Brighton.wav,/root/clawd/_datasets/clotho_3490684/audio_development/development/beach Brighton.wav,"As their children played in the park, two women continued on with their conversation.","As their children played in the park, two women continued on with their conversation.",Children are playing as adults are chatting in the background.,Children playing and chatting with adults in the playground.,Parents and children are playing on the ground of a playground.,Parents are playing with their children on the ground.,development,beach Brighton.wav,44100,20.3565306122449,23.73,1.5035424938735216,1.7534827982039936,,0.0,9244.78001840901,993.5915998406459,0.032423501890471426,"",34.458
development/outdoors ambient windy wind leaves rustle near airport plane hum.wav,/root/clawd/_datasets/clotho_3490684/audio_development/development/outdoors ambient windy wind leaves rustle near airport plane hum.wav,A bird chirps in the background as a hard rain falls on a house.,A bird chirps in the background as a hard rain falls on a house.,A waterfall rushes loudly as birds chirp gently in the background.,"As birds chirp gently in the background, a waterfall rushes loudly.",Rain coming down on an empty highway in front of a business.,Rain drops fall to the ground as birds chirp,development,outdoors ambient windy wind leaves rustle near airport plane hum.wav,44100,15.679591836734694,22.7,1.7665831236523264,1.4967041667767764,,0.0,5145.653833115405,683.5867515715487,0.07981419818363285,"",31.444
development/19_VACCL.wav,/root/clawd/_datasets/clotho_3490684/audio_development/development/19_VACCL.wav,A simple click turns on a vacuum cleaner that whirs along before a second click turns the engine off.,A simple click turns on a vacuum cleaner that whirs along before a second click turns the engine off.,A vacuum is on and then it is turned off,A vacuum is on and then turned off,A vacuum starting up and moving before slowing shutting off.,A vacuum starts up and moves around before slowly turning off.,development,19_VACCL.wav,44100,26.02750566893424,32.13,1.5944811156569052,1.073409670086661,,0.0,6843.556472908129,951.1515786025518,0.040371632930860164,"",47.048
development/Esperance Wind Farm Up Close.wav,/root/clawd/_datasets/clotho_3490684/audio_development/development/Esperance Wind Farm Up Close.wav,A dryer is running loudly while something inside hits the edges.,A dryer is running loudly while something inside hits the edges.,A dryer operates loudly as an object inside repeatedly strikes the sides.,A machine spins and roars as winds blow,"Winds blow as a machine operates loudly, spinning and roaring.",a machine was working and items were being banged around.,development,Esperance Wind Farm Up Close.wav,44100,27.446326530612247,24.02,1.0908382487235442,0.6608855684526245,,0.0,5819.791932300545,978.7843206880133,0.03328489076963146,"",46.764
development/FrogPond.wav,/root/clawd/_datasets/clotho_3490684/audio_development/development/FrogPond.wav,A frog croaks as insects buzz about it.,A frog croaks as insects buzz about it.,"A frog squawking, an airplane fly over and then a helicopter",An animal is making a lot of noise as it breathes.,Several frogs making noises outside during the night.,a frog is croaking with insects buzzing around,development,FrogPond.wav,44100,21.675102040816327,19.56,1.005317343534744,2.812211041434661,,0.0,5907.3972557714715,641.4724984744747,0.046728594940238254,"",25.313
development/rbh mocking bird.wav,/root/clawd/_datasets/clotho_3490684/audio_development/development/rbh mocking bird.wav,Birds are loudly chirping in the trees while the frogs croak in the pond.,Birds are loudly chirping in the trees while the frogs croak in the pond.,Birds slowly chirping then increasing the intensity of the chirp as time goes on.,Several birds tweet and sing songs as traffic passes,The birds loudly chirp in the trees and the frog croaks in the pond.,The traffic is going at a pace and several birds are tweeting and singing songs.,development,rbh mocking bird.wav,44100,20.445532879818593,27.03,2.1126230474219847,1.212920979194953,,0.0,45954.82773850644,1591.2567693386925,0.12305988339640725,"",30.737
development/20130418_stream.09.wav,/root/clawd/_datasets/clotho_3490684/audio_development/development/20130418_stream.09.wav,A person is putting water into a tub.,A person is putting water into a tub.,A river flowing over rocks and collecting into a pool outdoors.,"Outdoors, a river flows over rocks and collects into a pool.",Someone is filling a tub up with water.,Water flows into a storm drain from a street gutter.,development,20130418_stream.09.wav,44100,29.594739229024942,38.16,1.77476822594018,0.29557444431134183,,0.0,1728.3459568990088,510.0424407275135,0.023421384745486856,"",61.045
development/stream5.wav,/root/clawd/_datasets/clotho_3490684/audio_development/development/stream5.wav,A large volume of water is flowing down a gutter and into a storm drain.,A large volume of water is flowing down a gutter and into a storm drain.,Water falls continuously and collects while splashing softly.,Water is running steadily from a faucet into a sink while a washer runs in background.,Water flowed through a wide pipe and into the basin of a pond.,Water was flowing out of a large pipe into a pond,development,stream5.wav,44100,26.736507936507937,33.38,1.6471215009253573,0.6841857900406175,,0.0,4970.6535302585235,723.6357986951865,0.027300731382615517,"",61.629
development/Crowds in Street in Seville.wav,/root/clawd/_datasets/clotho_3490684/audio_development/development/Crowds in Street in Seville.wav,"At an outdoor market, children, men and women are chatting.","At an outdoor market, children, men and women are chatting.",People are having a conversation adjacent to a busy street.,People are talking and they get louder as a machine gets louder.,People are talking next to a busy street.,"Women, men, and kids at an outdoor market are talking.",development,Crowds in Street in Seville.wav,44100,20.670566893424038,30.65,1.4600627112139968,0.1291474901794426,,0.0,2502.91068932459,327.8089613807956,0.04920197399847866,"",45.087
development/School Kids Walk.wav,/root/clawd/_datasets/clotho_3490684/audio_development/development/School Kids Walk.wav,Children are playing on a playground adjacent to a street.,Children are playing on a playground adjacent to a street.,Children are playing on a playground next to a street.,Children racing and playing with nearby heavy traffic.,Kids are running and then begin to walk.,Several children are laughing and playing as they shuffled their feet while a vehicle passes in the background.,development,School Kids Walk.wav,44100,18.509977324263037,33.89,1.7055499510396628,2.1156226683566874,,0.0,4152.392270993476,552.0315398473709,0.049566754548089204,"",36.31
development/20060613.chicharras.wav,/root/clawd/_datasets/clotho_3490684/audio_development/development/20060613.chicharras.wav,A person walks along a path as cicadas chirp in the background.,A person walks along a path as cicadas chirp in the background.,An engine whirs as a person walks around outside.,Cicadas are singing while footfalls occur on a path.,Several different crickets making chirping noises from close and far,The crickets are making chirping noises from close up and far away.,development,20060613.chicharras.wav,44100,29.924761904761905,37.96,2.7266039218473894,0.38281045479813935,,0.0,791.1452697743886,200.00784285279198,0.025841840893859505,"",68.083
development/Concrete Stairs.wav,/root/clawd/_datasets/clotho_3490684/audio_development/development/Concrete Stairs.wav,A person is hammering an object with a rubber hammer,A person is hammering an object with a rubber hammer,A rhythmic clacking of footfalls against the floor.,Someone is walking around in a large room with a hardwood floor.,Someone walks around in a big room on a hardwood floor.,The rhythm of the footsteps against the floor.,development,Concrete Stairs.wav,44100,15.136643990929706,12.1,1.2024726840205149,4.462996391011439,,0.0,16574.302383257436,1634.7166003548145,0.02168982072232218,"",17.01
development/Sound Effect_1-2.wav,/root/clawd/_datasets/clotho_3490684/audio_development/development/Sound Effect_1-2.wav,A person speeds up and then slows down as the walk by outside.,A person speeds up and then slows down as the walk by outside.,Footfalls are audible and they suddenly become more intense.,"Someone is walking outside slowly, then they speed up, and slow down again.",Someone is walking slowly and then speeds up.,Someone is walking slowly then begins to speed up.,development,Sound Effect_1-2.wav,44100,23.16,12.437,1.6327386511463275,3.5125854467133677,,0.0,2273.0935639296454,594.578514034233,0.08589013889500516,"",36.222
development/distroy F3edback.wav,/root/clawd/_datasets/clotho_3490684/audio_development/development/distroy F3edback.wav,A loud whir in a small area that drives away.,A loud whir in a small area that drives away.,"A train horn blows, a train gets closer, and a train passes by.",The engine of an old fashioned propeller driven airplane.,The loud whir of an engine breaks the silence of a small area before the vehicle drives away.,a factory machine is running some people are working,development,distroy F3edback.wav,44100,20.58448979591837,40.53,0.929720493226401,1.1009335574419448,,0.0,55122.237440711775,1562.7452546532443,0.06609843080473224,"",29.628
development/Dogs_Barking.wav,/root/clawd/_datasets/clotho_3490684/audio_development/development/Dogs_Barking.wav,A dog is barking and a smaller dog barks in the background and then a large dog starts barking.,A dog is barking and a smaller dog barks in the background and then a large dog starts barking.,Dogs call out in loud whines to each other while cars honk at them to get off the road.,Dogs of varying sizes bark at different intervals.,Monkeys were audible and then dogs began to bark.,Monkeys were shouting and then dogs were barking,development,Dogs_Barking.wav,44100,21.640997732426303,17.46,1.1753584379465019,0.2483523125552408,,15.918779912984526,10225730.56266889,32908.17987179428,0.06673111009474147,"",23.343
development/Chmielna Street.wav,/root/clawd/_datasets/clotho_3490684/audio_development/development/Chmielna Street.wav,A group of three women converse as a crowd chatters in the background and footsteps crunch on the ground.,A group of three women converse as a crowd chatters in the background and footsteps crunch on the ground.,A woman in the background is speaking to someone else and something scrapes at the end.,"A woman speaking loudly, others speaking in the background, and then a child speaks.",Over the background of a chattering crowd and footsteps crunching on the ground three women converse,Several women converse as their children play in the background.,development,Chmielna Street.wav,44100,26.350975056689343,29.74,1.5854340978706964,1.1661746308095158,,0.0,5519.59078177253,853.9121522249034,0.033569782543318015,"",51.578
development/Street_Genova.wav,/root/clawd/_datasets/clotho_3490684/audio_development/development/Street_Genova.wav,A crowd of people are talking as a church bell is chiming,A crowd of people are talking as a church bell is chiming,A crowd of people are talking as a church bell is chiming in the background.,"A crowd of people chatters while periodically, in the background, a bell rings.",Church bells chime as people are chatting outdoors,Several people talking with each other at an outside park with church bells in the background.,development,Street_Genova.wav,44100,25.531156462585034,26.97,1.2997887134594703,1.351572286863573,,0.0,2872.280601850711,427.28392988956057,0.02668231338944744,"",44.962
